Id;lemme;anagramme;nb_lettres;nb_lettres2;syn_1;syn_2;syn_3;syn_4;syn_5;def_1;def_2;def_3
32225;cathodique;eouqhtdcia;˽ ˽ ˽ ˽ ˽  ˽ ˽ ˽ ˽ ˽;10;;;;;;(Physique) Qui a rapport à la cathode.;(Figuré) Qui a rapport à la télévision.;
32226;chuchotant;uahtchonct;˽ ˽ ˽ ˽ ˽  ˽ ˽ ˽ ˽ ˽;10;;;;;;Participe présent de chuchoter.;Qui chuchote.;
32227;constitutif;cstouiintft;˽ ˽ ˽  ˽ ˽  ˽ ˽  ˽ ˽ ˽ ˽;11;constituant;essentiel;inhérent;fondamental;naturel;Qui constitue essentiellement une chose.;(Droit) Qualifie les actes qui établissent un droit.;
32228;constitué;ottnciusé;˽ ˽ ˽  ˽ ˽ ˽  ˽ ˽ ˽;9;conformé;bâti;charpenté;organisé;composé;Établi par la constitution ou les lois du pays.;Qui est de bonne ou de mauvaise complexion.;Participe passé masculin singulier de constituer.
32230;dialectique;cdeqiilaetu;˽ ˽ ˽  ˽ ˽  ˽ ˽  ˽ ˽ ˽ ˽;11;maïeutique;argumentation;raisonnement;argument;dialogue;Qui a rapport aux règles du raisonnement.;Méthode de raisonnement, de questionnement et d’interprétation qui consiste à analyser la réalité en mettant en évidence les contradictions de celle-ci tout en cherchant à les dépasser.;Suite de raisonnements rigoureux visant à emporter l’adhésion de son interlocuteur.
32232;dominicain;ioniidacmn;˽ ˽ ˽ ˽ ˽  ˽ ˽ ˽ ˽ ˽;10;prêcheur;moine;frère;religieux;;Religieux, religieuse de l’ordre des Frères prêcheurs fondé par saint Dominique au xiiie siècle.;Relatif à l’ordre religieux.;Relatif à la République dominicaine.
32233;druidique;eudridiqu;˽ ˽ ˽  ˽ ˽ ˽  ˽ ˽ ˽;9;;;;;;Qui a rapport aux druides ou au druidisme.;;
32237;explicable;calxpleibe;˽ ˽ ˽ ˽ ˽  ˽ ˽ ˽ ˽ ˽;10;légitime;justifiable;motivé;compréhensible;pénétrable;Qui peut être expliqué.;;
32238;exploitable;aeeibxlpolt;˽ ˽ ˽  ˽ ˽  ˽ ˽  ˽ ˽ ˽ ˽;11;cultivable;opérationnel;utilisable;;;Qui peut être cultivé, exploité avec avantage.;Qui est en état de pouvoir être façonné et débité.;Dont on peut tirer parti.
32239;feuilleté;leefétlui;˽ ˽ ˽  ˽ ˽ ˽  ˽ ˽ ˽;9;pâtisserie;;;;;Qualifie un matériau en feuillets.;(Pâtisserie) Qualifie une pâtisserie dont la pâte se présente comme par feuillets.;Pâtisserie faite de pâte feuilletée.
32240;fondamentaliste;nseenodlfattmia;˽ ˽ ˽  ˽ ˽ ˽  ˽ ˽ ˽  ˽ ˽ ˽  ˽ ˽ ˽;15;jusqu'au-boutiste;ultra;intégriste;droitiste;extrémiste;Partisan du fondamentalisme, du retour aux fondements de la religion, d’un principe, etc.;(Spécialement) Partisan d'un retour à une vision originelle de la foi et de la doctrine chez les catholiques.;(Spécialement) Partisan de la vision traditionnelle de la religion chez les musulmans.
32244;glandulaire;dairnglulae;˽ ˽ ˽  ˽ ˽  ˽ ˽  ˽ ˽ ˽ ˽;11;;;;;;Qui a l'aspect, la forme ou la texture d'une glande.;Qui a rapport aux glandes.;Glanduleux.
32245;harassant;tassaharn;˽ ˽ ˽  ˽ ˽ ˽  ˽ ˽ ˽;9;éreintant;exténuant;épuisant;tuant;vannant;Qui harasse, épuise, fatigue énormément.;Participe présent de harasser.;
32246;identifiant;indfnaietti;˽ ˽ ˽  ˽ ˽  ˽ ˽  ˽ ˽ ˽ ˽;11;;;;;;Qui identifie, qui caractérise.;Attribut unique permettant d'identifier formellement quelqu'un ou quelque chose.;(Bases de données) Clé primaire.
32247;imprononçable;ioerpmaolnnçb;˽ ˽ ˽  ˽ ˽ ˽  ˽  ˽ ˽ ˽  ˽ ˽ ˽;13;;;;;;Que l’on n’arrive pas à prononcer.;Que l’on n’a pas le droit de dire.;
32248;inatteignable;eattlienbgian;˽ ˽ ˽  ˽ ˽ ˽  ˽  ˽ ˽ ˽  ˽ ˽ ˽;13;inapprochable;inattingible;hors d'atteinte;hors de portée;intouchable;Qui ne peut pas être atteint, en parlant d’un but, d’un objectif ou d’une chose concrète.;;
32250;indéfendable;féanidenlbed;˽ ˽ ˽  ˽ ˽ ˽  ˽ ˽ ˽  ˽ ˽ ˽;12;injustifiable;inexcusable;insoutenable;;;Qui ne peut être défendu.;;
32251;inhospitalier;stiliionaehpr;˽ ˽ ˽  ˽ ˽ ˽  ˽  ˽ ˽ ˽  ˽ ˽ ˽;13;hostile;rébarbatif;ingrat;farouche;inaccueillant;Qui n’est pas hospitalier, qui n’exerce pas l’hospitalité, qui est inhumain envers les étrangers.;;
32252;ininflammable;nammifanellbi;˽ ˽ ˽  ˽ ˽ ˽  ˽  ˽ ˽ ˽  ˽ ˽ ˽;13;incombustible;aphlogistique;ignifugé;apyre;ignifuge;Qui n’est pas inflammable.;;
41067;démaquiller;lleuimqdaré;˽ ˽ ˽  ˽ ˽  ˽ ˽  ˽ ˽ ˽ ˽;11;défarder;dépoudrer;;;;Enlever le maquillage.;;
41068;démesurer;smudeerré;˽ ˽ ˽  ˽ ˽ ˽  ˽ ˽ ˽;9;;;;;;Dérégler.;;
41070;fructifier;fuertcrifi;˽ ˽ ˽ ˽ ˽  ˽ ˽ ˽ ˽ ˽;10;prospérer;profiter;croître;se multiplier;abonder;(Botanique) Produire des fruits.;(Figuré) Produire un effet, un résultat avantageux.;
41072;gargouiller;ealrgrlgoiu;˽ ˽ ˽  ˽ ˽  ˽ ˽  ˽ ˽ ˽ ˽;11;glouglouter;égriser;;;;(Populaire) Produire des gargouillements ou des gargouillis.;;
41074;prédéterminer;derpirnérteém;˽ ˽ ˽  ˽ ˽ ˽  ˽  ˽ ˽ ˽  ˽ ˽ ˽;13;déterminer;;;;;(Théologie) Mouvoir et déterminer la volonté humaine, sa grâce, sa rédemption, etc., en parlant de Dieu.;Déterminer préalablement.;
41075;reformuler;rrurmolfee;˽ ˽ ˽ ˽ ˽  ˽ ˽ ˽ ˽ ˽;10;redéfinir;;;;;Réitérer un dire, une explication, une proposition, etc. sous une autre forme.;;
41076;remontrer;rrntmreoe;˽ ˽ ˽  ˽ ˽ ˽  ˽ ˽ ˽;9;reprocher;admonester;prêcher;critiquer;représenter;Montrer de nouveau.;(Pronominal) Se montrer de nouveau, reparaître.;Représenter à quelqu’un sa faute, son tort, son insuffisance.
41078;disloquer;lqreusoid;˽ ˽ ˽  ˽ ˽ ˽  ˽ ˽ ˽;9;démancher;démantibuler;déboîter;détraquer;déglinguer;Déplacer violemment une ou plusieurs parties d’un tout.;(Figuré) (Militaire) Séparer les différents corps d'une armée pour les répartir en plusieurs cantonnements ou garnisons.;
41079;diversifier;driesvieifr;˽ ˽ ˽  ˽ ˽  ˽ ˽  ˽ ˽ ˽ ˽;11;varier;bigarrer;compliquer;nuancer;élargir;Rendre divers.;;
41080;dénaturer;tndueréar;˽ ˽ ˽  ˽ ˽ ˽  ˽ ˽ ˽;9;déformer;fausser;altérer;frelater;corrompre;Altérer une chose dans sa nature ou dans ses qualités, faire qu’elle ne soit plus ce qu’elle était ou ce qu’elle devrait être.;(Fiscalité) (Commerce) Rendre impropre à la consommation humaine certains aliments, pour les destiner à des usages industriels, en y mélangeant certaines substances.;
41082;flamboyer;ymfalbore;˽ ˽ ˽  ˽ ˽ ˽  ˽ ˽ ˽;9;étinceler;fulgurer;rutiler;resplendir;reluire;Jeter une flamme brillante.;(Figuré) Briller comme une flamme.;
41091;émotionner;noemiotrné;˽ ˽ ˽ ˽ ˽  ˽ ˽ ˽ ˽ ˽;10;commotionner;impressionner;secouer;émouvoir;ébranler;(Familier) Causer une vive émotion.;;
41092;épousseter;roeéuptses;˽ ˽ ˽ ˽ ˽  ˽ ˽ ˽ ˽ ˽;10;vergeter;brosser;essuyer;étriller;nettoyer;Nettoyer avec un plumeau ou avec des époussettes.;;
41096;classifier;ilrseascfi;˽ ˽ ˽ ˽ ˽  ˽ ˽ ˽ ˽ ˽;10;inventorier;répertorier;hiérarchiser;cataloguer;répartir;Organiser des informations en catégories en fonction de certains critères. Déterminer les classes dans lesquelles les éléments pourront être classés.;(Programmation par objets) Classifieur.;
41097;couillonner;olocinelurn;˽ ˽ ˽  ˽ ˽  ˽ ˽  ˽ ˽ ˽ ˽;11;blouser;empaumer;pigeonner;berner;abuser;(Familier) Tromper, duper quelqu’un.;;
41098;dénombrer;rebmrédno;˽ ˽ ˽  ˽ ˽ ˽  ˽ ˽ ˽;9;recenser;lister;énumérer;cataloguer;nombrer;Énoncer pour en avoir un compte exact les personnes ou les choses qui forment un ensemble.;;
41100;fourmiller;mifelurlro;˽ ˽ ˽ ˽ ˽  ˽ ˽ ˽ ˽ ˽;10;grouiller;surabonder;foisonner;pulluler;abonder;Remuer, s’agiter en grand nombre, à la façon des fourmis.;(Par extension) Être réunis en grand nombre.;(Par extension) Être affecté d’un picotement comme si l’on sentait courir des fourmis sous la peau.
41101;intoxiquer;qiertnixou;˽ ˽ ˽ ˽ ˽  ˽ ˽ ˽ ˽ ˽;10;infecter;empoisonner;;;;(Médecine) Empoisonner.;(Figuré) (Contre-espionnage) Envoyer des informations erronées à l’adversaire afin de l’affaiblir.;
41102;lubrifier;fuebrilir;˽ ˽ ˽  ˽ ˽ ˽  ˽ ˽ ˽;9;huiler;graisser;oindre;enduire;;Rendre glissant.;(Sens propre) Enduire d'huile les pignons d'un mécanisme pour en faciliter le fonctionnement.;
41106;tachycarder;aaeyhctrrcd;˽ ˽ ˽  ˽ ˽  ˽ ˽  ˽ ˽ ˽ ˽;11;;;;;;(Médecine) Accélérer son rythme cardiaque, être atteint de tachycardie.;;
41107;acclimater;accaleimrt;˽ ˽ ˽ ˽ ˽  ˽ ˽ ˽ ˽ ˽;10;familiariser;habituer;styler;accoutumer;naturaliser;Habituer à un climat autre que celui du pays natal.;(Pronominal) S'habituer à un autre climat.;(Pronominal) (Figuré) S'adapter à un nouvel environnement (social, culturel, moral, etc.)
41109;amnistier;nriaitmes;˽ ˽ ˽  ˽ ˽ ˽  ˽ ˽ ˽;9;pardonner;absoudre;gracier;acquitter;excuser;(Droit) Accorder une amnistie, gracier.;Excuser, pardonner, oublier, passer l’éponge.;
41110;décongeler;erécdglnoe;˽ ˽ ˽ ˽ ˽  ˽ ˽ ˽ ˽ ˽;10;déglacer;dégeler;fondre;;;Ramener, par réchauffement progressif, un corps congelé à son état primitif.;;
41111;entailler;aenterlli;˽ ˽ ˽  ˽ ˽ ˽  ˽ ˽ ˽;9;taillader;entamer;écorner;balafrer;écharper;Couper, en y pratiquant une entaille, une pierre, une pièce de bois, etc.;(Par analogie) (Géographie) Marquer, par une profonde entaille, le relief.;
41112;entériner;erternéin;˽ ˽ ˽  ˽ ˽ ˽  ˽ ˽ ˽;9;ratifier;sanctionner;valider;homologuer;abonder dans;(Droit) Ratifier ou enregistrer juridiquement un acte qui ne pourrait valoir sans cette formalité.;(Par extension) Approuver un rapport, une décision et le cas échéant le mettre en application.;
41114;fourvoyer;fuvoeroyr;˽ ˽ ˽  ˽ ˽ ˽  ˽ ˽ ˽;9;induire en erreur;désorienter;dérouter;égarer;dépister;Égarer, détourner du bon chemin.;(Figuré) Tromper, égarer.;
41118;recomposer;erercpomso;˽ ˽ ˽ ˽ ˽  ˽ ˽ ˽ ˽ ˽;10;reconstituer;synthétiser;rétablir;refaire;recombiner;Composer une seconde fois.;(Chimie) Réunir les parties d’un corps qui avaient été séparées par quelque opération.;(Imprimerie) Composer à nouveau un texte.
41119;reconnecter;oceecerntrn;˽ ˽ ˽  ˽ ˽  ˽ ˽  ˽ ˽ ˽ ˽;11;;;;;;Connecter à nouveau.;;
41124;subtiliser;esiusbirtl;˽ ˽ ˽ ˽ ˽  ˽ ˽ ˽ ˽ ˽;10;choper;quintessencier;kidnapper;chiper;dérober;(Vieilli) Rendre subtil, volatiliser.;(Familier) Faire disparaître, dérober, voler.;Mettre trop de finesse, d’ingéniosité dans une pensée, dans une expression, dans une action.
41126;assouplir;prualisso;˽ ˽ ˽  ˽ ˽ ˽  ˽ ˽ ˽;9;apprivoiser;pétrir;déraidir;adoucir;corroyer;Rendre souple.;(Équitation) Habituer un cheval à se mouvoir avec souplesse.;(Figuré) Donner de la souplesse dans les manières.
41127;atrophier;iphetrora;˽ ˽ ˽  ˽ ˽ ˽  ˽ ˽ ˽;9;étioler;rabougrir;amaigrir;amoindrir;affaiblir;Faire dépérir par atrophie.;(Pronominal) Être atteint d’atrophie.;
41128;autodétruire;erituadrtéou;˽ ˽ ˽  ˽ ˽ ˽  ˽ ˽ ˽  ˽ ˽ ˽;12;;;;;;Se détruire soi-même.;;
41130;compresser;cserperoms;˽ ˽ ˽ ˽ ˽  ˽ ˽ ˽ ˽ ˽;10;densifier;tasser;comprimer;écraser;serrer;Comprimer, exercer une pression continue.;(Informatique) Diminuer la taille d’un ou de plusieurs fichiers au moyen d’un algorithme permettant leur restitution à l’identique, en vue de les stocker ou de les transférer.;
41131;contrefaire;aortcierenf;˽ ˽ ˽  ˽ ˽  ˽ ˽  ˽ ˽ ˽ ˽;11;singer;simuler;imiter;parodier;pasticher;Imiter une personne, une chose.;Feindre d’être ce qu’on n’est pas.;(En particulier) Imiter par contrefaçon, par contrefaction.
41136;désarçonner;açoensrrndé;˽ ˽ ˽  ˽ ˽  ˽ ˽  ˽ ˽ ˽ ˽;11;désemparer;déconcerter;démonter;décontenancer;vider les étriers;Mettre hors des arçons, jeter hors de la selle.;(Figuré) (Familier) Confondre quelqu’un dans une discussion, le mettre hors d’état de répondre.;
41139;galvaniser;eanvsralig;˽ ˽ ˽ ˽ ˽  ˽ ˽ ˽ ˽ ˽;10;électriser;métalliser;enfiévrer;survolter;exalter;Électriser au moyen de la pile galvanique ou pile de Volta.;(En particulier) Mettre les muscles en mouvement, soit pendant la vie, soit peu de temps après la mort, au moyen de la pile galvanique.;(Métallurgie) Plonger un métal dans un bain de zinc fondu pour le recouvrir d’une couche de ce métal et le préserver de l’oxydation.
41141;mouvementer;uonvmetemer;˽ ˽ ˽  ˽ ˽  ˽ ˽  ˽ ˽ ˽ ˽;11;perturber;;;;;Faire bouger.;(Spécialement) (Bijouterie) Bouger (la main).;(Pronominal) Se mouvementer, se donner du mouvement, un mouvement.
41144;réaffecter;efetfécarr;˽ ˽ ˽ ˽ ˽  ˽ ˽ ˽ ˽ ˽;10;;;;;;"Affecter à nouveau ; faire changer d’affectation.";;
41145;structurer;resruurttc;˽ ˽ ˽ ˽ ˽  ˽ ˽ ˽ ˽ ˽;10;ordonnancer;articuler;charpenter;hiérarchiser;organiser;Donner une structure.;;
41151;gangrener;rggneaern;˽ ˽ ˽  ˽ ˽ ˽  ˽ ˽ ˽;9;infecter;vicier;corrompre;empester;pervertir;(Médecine) Affecter de gangrène.;(Médecine) Emploi pronominal : développer une gangrène.;(Figuré) Corrompre entièrement.
41152;inséminer;irenmiésn;˽ ˽ ˽  ˽ ˽ ˽  ˽ ˽ ˽;9;;;;;;(Biologie) (Médecine) (Zootechnie) Action d'apporter naturellement ou artificiellement la semence mâle sur les ovules d’une femelle, en vue de les féconder.;(Par extension) (Médecine) (Zootechnie) Action de féconder artificiellement, pratiquer l'insémination artificielle.;(Figuré) (Péjoratif) Subir, accepter un coït.
41155;obnubiler;bnreoulbi;˽ ˽ ˽  ˽ ˽ ˽  ˽ ˽ ˽;9;hypnotiser;obstruer;obscurcir;obséder;;Couvrir d’une sorte de nuage, obscurcir, affaiblir.;(Figuré) Obséder, s’imposer en permanence à l’esprit.;
41156;pinailler;enrlilapi;˽ ˽ ˽  ˽ ˽ ˽  ˽ ˽ ˽;9;ergoter;chercher la petite bête;ratiociner;argumenter;pignocher;(Familier) (Péjoratif) S’attarder sur des détails sans intérêt, argumenter avec des précisions superflues, de façon mesquine.;;
41159;épouiller;lloéepiur;˽ ˽ ˽  ˽ ˽ ˽  ˽ ˽ ˽;9;épucer;pouiller;éplucher;;;Débarrasser quelqu’un de ses poux.;;
41160;éviscérer;rcvésiére;˽ ˽ ˽  ˽ ˽ ˽  ˽ ˽ ˽;9;vider;;;;;Enlever les viscères de.;;
41162;boulanger;gnrouebal;˽ ˽ ˽  ˽ ˽ ˽  ˽ ˽ ˽;9;fournier;gindre;mitron;;;Personne dont le métier est de fabriquer le pain.;Tenant d’une boulangerie.;Préparer et faire cuire le pain.
41169;temporiser;esorpiermt;˽ ˽ ˽ ˽ ˽  ˽ ˽ ˽ ˽ ˽;10;faire traîner;retarder;surseoir;atermoyer;différer;Retarder, différer, dans l’attente d’une occasion favorable, d’un temps plus propice.;;
41170;traficoter;trfortceia;˽ ˽ ˽ ˽ ˽  ˽ ˽ ˽ ˽ ˽;10;magouiller;agioter;boursicoter;comploter;mijoter;(Familier) Bricoler, bidouiller, trafiquer.;;
41171;traînasser;rassaînetr;˽ ˽ ˽ ˽ ˽  ˽ ˽ ˽ ˽ ˽;10;lambiner;fainéanter;vadrouiller;musarder;flâner;Traîner, ne rien faire de très intéressant.;(Rare) Faire traîner en longueur.;
41172;vociférer;rioéervfc;˽ ˽ ˽  ˽ ˽ ˽  ˽ ˽ ˽;9;s'égosiller;hurler;beugler;gueuler;brailler;"Parler avec l’accent de la colère ; pousser des clameurs.";;
41177;discutailler;stealuciildr;˽ ˽ ˽  ˽ ˽ ˽  ˽ ˽ ˽  ˽ ˽ ˽;12;disputailler;ergoter;argumenter;palabrer;discuter;Discuter sans cesse de choses insignifiantes.;;
41185;renflouer;efrnuerol;˽ ˽ ˽  ˽ ˽ ˽  ˽ ˽ ˽;9;afflouer;déséchouer;remettre à flot;mettre à flot;;(Marine) Remettre un vaisseau à flot.;(Finance) Remettre sur pied un problème de trésorerie.;
41188;récidiver;verérdici;˽ ˽ ˽  ˽ ˽ ˽  ˽ ˽ ˽;9;rechuter;recommencer;retomber;réapparaître;réitérer;Faire une récidive, retomber dans une faute, commettre de nouveau le même délit, le même crime.;(Médecine) Reparaître après un laps de temps plus ou moins long, en parlant d'une maladie guérie.;
41189;supplicier;psupeilirc;˽ ˽ ˽ ˽ ˽  ˽ ˽ ˽ ˽ ˽;10;bourreler;martyriser;mettre à mort;torturer;crucifier;Faire souffrir le supplice de la mort.;(Par hyperbole) Faire souffrir vivement.;
41190;tenailler;rlileenta;˽ ˽ ˽  ˽ ˽ ˽  ˽ ˽ ˽;9;bourreler;martyriser;torturer;faire souffrir;lanciner;Tourmenter un criminel avec des tenailles ardentes.;(Figuré) Faire souffrir, causer une vive douleur.;
41191;virevolter;riveetovrl;˽ ˽ ˽ ˽ ˽  ˽ ˽ ˽ ˽ ˽;10;pivoter;pirouetter;tournoyer;virevousser;volter;(Équitation) Faire des virevoltes.;(Figuré) Se déplacer en tournoyant.;
41197;commercialiser;airomclriemesc;˽ ˽ ˽ ˽  ˽ ˽ ˽  ˽ ˽ ˽  ˽ ˽ ˽ ˽;14;mercantiliser;exploiter;vendre;fournir;;"Mettre un nouveau produit sur le marché ; le rendre disponible à la vente.";;
41199;conforter;cortenrfo;˽ ˽ ˽  ˽ ˽ ˽  ˽ ˽ ˽;9;réconforter;revigorer;fortifier;affermir;corroborer;(Vieilli) Fortifier par des encouragements, des consolations.;;
41203;enfourner;ornfuneer;˽ ˽ ˽  ˽ ˽ ˽  ˽ ˽ ˽;9;engouffrer;fourrer;caser;ingurgiter;emballer;Mettre dans le four.;Emplir ou remplir sommairement ou sans ménagement.;
41210;peinturlurer;intuerulrerp;˽ ˽ ˽  ˽ ˽ ˽  ˽ ˽ ˽  ˽ ˽ ˽;12;peinturer;gribouiller;colorier;barioler;barbouiller;(Familier) Peindre sans connaissance de la peinture, par amusement.;;
41211;pendouiller;oreipudllne;˽ ˽ ˽  ˽ ˽  ˽ ˽  ˽ ˽ ˽ ˽;11;pendre;;;;;(Péjoratif) Pendre mollement.;;
41212;professer;srferopes;˽ ˽ ˽  ˽ ˽ ˽  ˽ ˽ ˽;9;tenir pour;enseigner;exercer;proclamer;apprendre;Avouer publiquement, reconnaître hautement quelque chose.;(Vieilli) Exercer.;"Proclamer ; dire au public."
41216;rentabiliser;binarlseirte;˽ ˽ ˽  ˽ ˽ ˽  ˽ ˽ ˽  ˽ ˽ ˽;12;tayloriser;amortir;;;;Faire devenir rentable.;;
41218;réapprovisionner;npipoaerirérsnvo;˽ ˽ ˽ ˽  ˽ ˽ ˽ ˽  ˽ ˽ ˽ ˽  ˽ ˽ ˽ ˽;16;recharger;réassortir;regonfler;repeupler;remonter;Approvisionner à nouveau (quelque chose dont le stock est trop réduit).;;
41222;autopsier;trepaouis;˽ ˽ ˽  ˽ ˽ ˽  ˽ ˽ ˽;9;;;;;;Pratiquer une autopsie.;;
41224;disséminer;déiissmren;˽ ˽ ˽ ˽ ˽  ˽ ˽ ˽ ˽ ˽;10;éparpiller;égailler;disperser;joncher;semer;Semer çà et là, éparpiller, répandre.;;
41228;pénaliser;psléiaren;˽ ˽ ˽  ˽ ˽ ˽  ˽ ˽ ˽;9;impacter;punir;;;;Rendre le droit pénal applicable à.;Rendre moins compétitif.;
41229;réaffirmer;fféerarmri;˽ ˽ ˽ ˽ ˽  ˽ ˽ ˽ ˽ ˽;10;;;;;;Affirmer de nouveau.;;
41232;bidouiller;liduolebir;˽ ˽ ˽ ˽ ˽  ˽ ˽ ˽ ˽ ˽;10;bricoler;trafiquer;;;;(Familier) Bricoler, fabriquer, transformer, trafiquer quelque chose, généralement de façon rapide et artisanale.;;
41235;disproportionner;oipotsnrrridenpo;˽ ˽ ˽ ˽  ˽ ˽ ˽ ˽  ˽ ˽ ˽ ˽  ˽ ˽ ˽ ˽;16;;;;;;Ne pas respecter des proportions normales pour.;;
41236;décolorer;rrdlcooeé;˽ ˽ ˽  ˽ ˽ ˽  ˽ ˽ ˽;9;défraîchir;faner;déteindre;ternir;affadir;"Dépourvoir de sa couleur ; ôter, altérer la couleur.";(Pronominal) (Réfléchi) Perdre ses couleurs d'origine.;
41239;revouloir;vrliuoreo;˽ ˽ ˽  ˽ ˽ ˽  ˽ ˽ ˽;9;;;;;;Vouloir de nouveau.;;
41241;resquiller;urrsieellq;˽ ˽ ˽ ˽ ˽  ˽ ˽ ˽ ˽ ˽;10;écornifler;se faufiler;frauder;se glisser;tricher;Faire une petite tricherie, en particulier pour ne pas payer ce qui aurait dû l’être (par exemple son voyage dans les transports en commun).;;
41245;solidifier;idiiolsrfe;˽ ˽ ˽ ˽ ˽  ˽ ˽ ˽ ˽ ˽;10;caillebotter;figer;durcir;épaissir;concréter;"Rendre solide, ou plus solide, un objet ; étayer une construction.";(Didactique) Rendre solide ce qui était liquide.;Au figuré Rendre plus consistant, plus ferme, plus sûr, consolider.
41247;valoriser;seroalriv;˽ ˽ ˽  ˽ ˽ ˽  ˽ ˽ ˽;9;recycler;porter aux nues;porter au pinacle;retraiter;réutiliser;Augmenter le prix ou la rentabilité de quelque chose, donner plus de valeur à quelque chose.;"Présenter de façon avantageuse ; donner plus d’importance.";(Finance) Estimer, évaluer la valeur d'un bien, d'une entreprise.
41250;amalgamer;aaagmrmel;˽ ˽ ˽  ˽ ˽ ˽  ˽ ˽ ˽;9;intégrer;mêler;incorporer;mélanger;assimiler;(Chimie) Combiner le mercure avec un autre métal.;(Figuré) (Familier) Rapprocher et unir des choses différentes.;
41252;défenestrer;térdnfseree;˽ ˽ ˽  ˽ ˽  ˽ ˽  ˽ ˽ ˽ ˽;11;;;;;;Jeter quelqu'un par une fenêtre.;(Par extension) Jeter quelque chose par une fenêtre.;
41258;recentrer;reencrret;˽ ˽ ˽  ˽ ˽ ˽  ˽ ˽ ˽;9;concentrer;;;;;Faire revenir vers le centre.;;
41261;transiter;artsrntei;˽ ˽ ˽  ˽ ˽ ˽  ˽ ˽ ˽;9;faire passer;transporter;passer;;;Voyager en transit.;;
41262;transparaître;ertpîrtnaaras;˽ ˽ ˽  ˽ ˽ ˽  ˽  ˽ ˽ ˽  ˽ ˽ ˽;13;se faire jour;se révéler;se manifester;apparaître;poindre;Paraître comme à travers un voile.;;
41264;échafauder;aacuehdrfé;˽ ˽ ˽ ˽ ˽  ˽ ˽ ˽ ˽ ˽;10;bâtir;élaborer;inventer;concocter;mijoter;Dresser des échafaudages, en parlant de la construction ou de la décoration des bâtiments.;(Figuré) Bâtir avec précipitation et sans ordre un projet, une théorie, une argumentation qui n’offre pas de caractère solide et durable.;
41266;cafouiller;aforlcieul;˽ ˽ ˽ ˽ ˽  ˽ ˽ ˽ ˽ ˽;10;s'emmêler;s'embrouiller;battre la breloque;baragouiner;s'emberlificoter;(Familier) S’embrouiller.;(Mécanique) (Familier) Avoir des ratés et menacer de caler, en parlant d’un moteur à explosion.;(Côte d’ivoire) Chercher des histoires.
41267;défricher;deéichrrf;˽ ˽ ˽  ˽ ˽ ˽  ˽ ˽ ˽;9;débroussailler;essarter;dégrossir;déblayer;déboiser;Transformer, une terre jusqu'alors boisée, ou en friche, en terre cultivée : la rendre cultivable.;(Figuré) Défricher un domaine jusqu'alors inconnu: jeter les bases d'une science nouvelle.;
41269;esclaffer;fesleafrc;˽ ˽ ˽  ˽ ˽ ˽  ˽ ˽ ˽;9;pouffer;éclater de rire;se tordre;rire;éclater;(Pronominal) (Familier) Éclater de rire bruyamment.;(Transitif) (Sud de la France) Faire éclater.;
41270;formaliser;saormrefil;˽ ˽ ˽ ˽ ˽  ˽ ˽ ˽ ˽ ˽;10;mathématiser;axiomatiser;instituer;;;Structurer de manière formelle, formuler avec précision selon les règles en vigueur dans un domaine scientifique.;;
41271;insupporter;utoenprisrp;˽ ˽ ˽  ˽ ˽  ˽ ˽  ˽ ˽ ˽ ˽;11;horripiler;hérisser;indisposer;turlupiner;excéder;"(Familier) Agacer au plus haut point ; être insupportable pour quelqu’un.";;
41273;prophétiser;rohsepprtéi;˽ ˽ ˽  ˽ ˽  ˽ ˽  ˽ ˽ ˽ ˽;11;prédire;pronostiquer;augurer;vaticiner;présager;Prédire l’avenir par inspiration divine.;Dans le style biblique, ce verbe peut avoir pour complément d’objet direct les gens ou les nations à qui l’on adresse des prophéties qui les concernent.;(Par extension) Prévoir et dire d’avance ce qui doit arriver.
41274;repoudrer;opredreru;˽ ˽ ˽  ˽ ˽ ˽  ˽ ˽ ˽;9;;;;;;Poudrer à nouveau.;;
41277;amenuiser;semiaunre;˽ ˽ ˽  ˽ ˽ ˽  ˽ ˽ ˽;9;allégir;amincir;rapetisser;alléger;amputer;Rendre plus menu.;(Pronominal) Devenir plus menu.;
41280;coexister;tixscreeo;˽ ˽ ˽  ˽ ˽ ˽  ˽ ˽ ˽;9;cohabiter;coïncider;;;;Exister simultanément.;;
41281;complexer;comlepexr;˽ ˽ ˽  ˽ ˽ ˽  ˽ ˽ ˽;9;inhiber;paralyser;;;;(Psychologie) Inhiber, donner des complexes à quelqu’un.;(Psychologie) Se sentir mal à l’aise à cause d'un complexe.;(Chimie) Provoquer la formation d’un complexe chimique à partir d’un ion ou d'un atome métallique.
41285;fanfaronner;fnronnefraa;˽ ˽ ˽  ˽ ˽  ˽ ˽  ˽ ˽ ˽ ˽;11;tartariner;frimer;crâner;hâbler;romancer;Prétendre ouvertement à des actions ou des qualités.;;
41292;tétaniser;éatresnti;˽ ˽ ˽  ˽ ˽ ˽  ˽ ˽ ˽;9;statufier;figer;pétrifier;glacer;abasourdir;Rendre tétanique.;(Figuré) Être mis en incapacité en proie à une affliction particulière.;
41293;écarteler;réertleac;˽ ˽ ˽  ˽ ˽ ˽  ˽ ˽ ˽;9;tirailler;démembrer;fissurer;démancher;disloquer;(Histoire) Démembrer un condamné en le tirant par les quatre membres, à quatre chevaux.;(Héraldique) Partager l’écu en quatre.;
41295;carillonner;railcnreonl;˽ ˽ ˽  ˽ ˽  ˽ ˽  ˽ ˽ ˽ ˽;11;claironner;corner;trompeter;sonnailler;sonner;Sonner le carillon.;Exécuter un air sur un carillon.;(Figuré) (Familier) Sonner à coups redoublés.
41297;cristalliser;lalctsirseir;˽ ˽ ˽  ˽ ˽ ˽  ˽ ˽ ˽  ˽ ˽ ˽;12;solidifier;concrétiser;stabiliser;agglomérer;immobiliser;Congeler en manière de cristal.;"(Figuré) Rendre intangible, invariable ; figer.";(Intransitif) Se former en cristaux, soit naturellement, soit par des procédés chimiques.
41298;distendre;rdsteeind;˽ ˽ ˽  ˽ ˽ ˽  ˽ ˽ ˽;9;dilater;ballonner;élargir;boursoufler;étirer;Élargir ou allonger par la tension.;;
41299;domestiquer;uitseqormde;˽ ˽ ˽  ˽ ˽  ˽ ˽  ˽ ˽ ˽ ˽;11;apprivoiser;dompter;asservir;soumettre;avilir;Rendre domestique un animal sauvage.;(Par extension) En parlant des hommes, asservir, priver de l’indépendance.;(Par extension) Rendre utilisable par l’homme.
41300;décentrer;etdnrcére;˽ ˽ ˽  ˽ ˽ ˽  ˽ ˽ ˽;9;;;;;;(Arts) (Mécanique) Rendre irrégulier en déplaçant le centre.;Placer hors du centre géographique ou de gravité, ou de l’axe, d’un lieu, d’un objet ou d’un concept. ;(Psychologie) S’éloigner d’un centre d’intérêt.
41302;dépeupler;ledppéuer;˽ ˽ ˽  ˽ ˽ ˽  ˽ ˽ ˽;9;déboiser;désépaissir;éclaircir;nettoyer;vider;Dégarnir d’habitants une ville, un pays, etc.;Dégarnir d'animaux un élevage, un territoire de chasse.;Dégarnir une forêt, une pépinière, en en tirant une trop grande quantité d’arbres ou de plants.
41303;gargariser;agsgrarrie;˽ ˽ ˽ ˽ ˽  ˽ ˽ ˽ ˽ ˽;10;;;;;;Laver la gorge avec de l’eau ou avec quelque autre liquide, en le faisant entrer le plus avant qu’il se peut et en le repoussant à diverses reprises pour s’empêcher de l’avaler.;(Figuré) Savourer ses propres propos avec vanité.;
