Id;lemme;anagramme;nb_lettres;nb_lettres2;syn_1;syn_2;syn_3;syn_4;syn_5;def_1;def_2;def_3
30815;occipital;lpccitoia;˽ ˽ ˽  ˽ ˽ ˽  ˽ ˽ ˽;9;iniaque;;;;;(Anatomie) Qui appartient à l’occiput.;(Anatomie) Synonyme d’os occipital.;
30818;recouvert;tvocrreue;˽ ˽ ˽  ˽ ˽ ˽  ˽ ˽ ˽;9;enveloppé;vêtu;;;;Complètement couvert.;Participe passé masculin singulier du verbe recouvrir.;
30821;ultramoderne;noeuelrmdatr;˽ ˽ ˽  ˽ ˽ ˽  ˽ ˽ ˽  ˽ ˽ ˽;12;up to date;moderniste;dernier cri;moderne;nouveau;Très moderne.;;
30823;victorien;vinrciote;˽ ˽ ˽  ˽ ˽ ˽  ˽ ˽ ˽;9;;;;;;(Histoire) Relatif aux mœurs, à l’architecture, à la morale ou à la politique anglaises sous le règne de la reine Victoria du Royaume-Uni.;(Géographie) Relatif à Saint-Victor-l’Abbaye, commune française située dans le département de la Seine-Maritime.;(Géographie) Relatif à Voiteur, commune française située dans le département du Jura.
30824;animalier;aiealmrin;˽ ˽ ˽  ˽ ˽ ˽  ˽ ˽ ˽;9;peintre;;;;;(Arts) Artiste qui dessine, peint ou sculpte les bêtes.;(Zoologie) Personne chargée de s'occuper des animaux dans une animalerie, un établissement zoologique.;Relatif aux animaux.
30825;astrologique;uilrgsqoaeot;˽ ˽ ˽  ˽ ˽ ˽  ˽ ˽ ˽  ˽ ˽ ˽;12;astronomique;;;;;Relatif à l’astrologie.;;
30829;cruciforme;ermroccuif;˽ ˽ ˽ ˽ ˽  ˽ ˽ ˽ ˽ ˽;10;crucial;;;;;Qui est en forme de croix.;(Botanique) Dont les pétales sont disposés en forme de croix.;(Minéralogie) Se dit d’un cristal composé de deux autres qui se croisent de manière que les pans de l’un soient perpendiculaires à ceux de l’autre.
30830;daltonien;ndnaelito;˽ ˽ ˽  ˽ ˽ ˽  ˽ ˽ ˽;9;dichromate;;;;;Personne atteinte de daltonisme, c’est-à-dire ne différenciant pas certaines couleurs.;Qui est atteint de daltonisme.;
30832;ecclésiastique;icclqéateusesi;˽ ˽ ˽ ˽  ˽ ˽ ˽  ˽ ˽ ˽  ˽ ˽ ˽ ˽;14;homme d'Église;homme de Dieu;pasteur;prêtre;confessionnel;Qui a rapport à l’Église, au clergé.;Membre du clergé.;
30833;entreprenant;prenntareetn;˽ ˽ ˽  ˽ ˽ ˽  ˽ ˽ ˽  ˽ ˽ ˽;12;proactif;dynamique;agissant;industrieux;aventureux;Qui se porte hardiment à une entreprise, à une aventure.;(Par extension) Qui est téméraire dans ses entreprises, ou disposé à entreprendre sur le droit d’autrui.;(Absolument) Qualifie un homme hardi auprès des femmes.
30835;gastronomique;itoegoaqrnmus;˽ ˽ ˽  ˽ ˽ ˽  ˽  ˽ ˽ ˽  ˽ ˽ ˽;13;culinaire;gourmand;;;;Qui a rapport à la gastronomie.;;
30836;grisonnant;tnnigornas;˽ ˽ ˽ ˽ ˽  ˽ ˽ ˽ ˽ ˽;10;blanchissant;poivre et sel;;;;Qui grisonne.;Participe présent de grisonner.;
30837;imperméable;plrimmebéea;˽ ˽ ˽  ˽ ˽  ˽ ˽  ˽ ˽ ˽ ˽;11;inaccessible;étanche;waterproof;réfractaire;impénétrable;(Physique) Qui ne se laisse point traverser, en parlant de certains corps.;(Absolument) Qualifie un cuir, une étoffe, etc., apprêtés de manière que l’eau ne saurait les traverser.;(Habillement) Vêtement utilisé pour se protéger de la pluie.
30838;lancinant;cainnnlat;˽ ˽ ˽  ˽ ˽ ˽  ˽ ˽ ˽;9;obsédant;torturant;cuisant;crispant;déchirant;(Médecine) Qui se fait sentir par élancements. Il n’est guère usité que dans cette locution,;"(Figuré) Qui taraude l’esprit ; obsédant.";Participe présent de lanciner.
30841;praticable;laratpbiec;˽ ˽ ˽ ˽ ˽  ˽ ˽ ˽ ˽ ˽;10;allable;empruntable;exécutable;faisable;carrossable;Qui peut être pratiqué, qui peut être employé, dont on peut se servir.;Par lequel on peut passer aisément.;(Théâtre) Qualifie une porte ou fenêtre du décor, qui n’est pas seulement figurée, et que l’on peut ouvrir ou fermer.
30842;pédiatrique;qtiérdeaupi;˽ ˽ ˽  ˽ ˽  ˽ ˽  ˽ ˽ ˽ ˽;11;néonatal;;;;;Relatif à la pédiatrie.;;
30843;rhétorique;uqoreriéth;˽ ˽ ˽ ˽ ˽  ˽ ˽ ˽ ˽ ˽;10;déclamation;pathos;bien-dire;éloquence;emphase;Oratoire, relatif à l’art de bien parler.;Science (au sens d’étude structurée) et art (au sens de pratique reposant sur un savoir éprouvé) qui se rapporte à l’action du discours sur les esprits.;(Éducation) (Désuet) Classe de lycée, équivalente à la terminale actuelle, où l’on enseignait la rhétorique. — Note :  Existe encore en Belgique.
30844;récalcitrant;lacétrtnirac;˽ ˽ ˽  ˽ ˽ ˽  ˽ ˽ ˽  ˽ ˽ ˽;12;rétif;indocile;rebelle;insoumis;désobéissant;"Qui résiste avec opiniâtreté ; qui ne se laisse pas faire. ";Qui résiste, qu'on ne peut agencer à son gré, en parlant d'une chose. ;Personne récalcitrante.
30845;stalinien;seanitnil;˽ ˽ ˽  ˽ ˽ ˽  ˽ ˽ ˽;9;;;;;;Qui se rapporte à Staline, son régime politique et aux doctrines utilisées pour le justifier.;(Histoire) Partisan de Staline.;(France) (Familier) (Péjoratif) Nom qui était donné aux membres du Parti communiste français.
30846;tentateur;tuatreten;˽ ˽ ˽  ˽ ˽ ˽  ˽ ˽ ˽;9;aguicheur;serpent;démon;séducteur;diable;Celui qui tente.;(Religion) (Au singulier) (Au masculin) Le démon. — Note :  Dans ce sens l'on emploie l'article défini.;Qui soumet à la tentation.
30848;vénézuélien;énlééeiznvu;˽ ˽ ˽  ˽ ˽  ˽ ˽  ˽ ˽ ˽ ˽;11;;;;;;(Géographie) Relatif au Vénézuéla.;;
30850;abordable;rlobadabe;˽ ˽ ˽  ˽ ˽ ˽  ˽ ˽ ˽;9;accessible;accostable;approchable;bon marché;traitable;(Rare) Qu’on peut aborder.;(Figuré) Facile d'accès, en parlant d'une personne.;(Courant) Modéré, en parlant d'un prix.
30851;acrobatique;coiaaeqtubr;˽ ˽ ˽  ˽ ˽  ˽ ˽  ˽ ˽ ˽ ˽;11;périlleux;difficile;;;;Relatif aux acrobates et aux acrobaties.;;
30854;cosmétique;eqsituocém;˽ ˽ ˽ ˽ ˽  ˽ ˽ ˽ ˽ ˽;10;brillantine;gomina;bandoline;cosmétologie;laque;Qui sert à entretenir la peau, les cheveux, la barbe.;(Ironique) Inefficace ou peu efficace, qui n’a d’effet qu’en apparence.;Produit de beauté.
30855;expéditif;efiptxdéi;˽ ˽ ˽  ˽ ˽ ˽  ˽ ˽ ˽;9;diligent;pressé;preste;rapide;prompt;Qui expédie promptement les affaires, la besogne dont il est chargé.;;
30857;froussard;afrdssrou;˽ ˽ ˽  ˽ ˽ ˽  ˽ ˽ ˽;9;peureux;poltron;couard;foireux;lâche;(Familier) Peureux.;(Familier) Personne peureuse.;
30864;marécageux;eraucmgxéa;˽ ˽ ˽ ˽ ˽  ˽ ˽ ˽ ˽ ˽;10;uligineux;bourbeux;aquatique;aqueux;stagnant;Qui est de la nature du marécage.;Qui est morbide, malsain ou étouffant.;
30865;modulateur;dourteulma;˽ ˽ ˽ ˽ ˽  ˽ ˽ ˽ ˽ ˽;10;;;;;;Celui ou celle qui pratique bien la modulation, l’art de moduler.;(Informatique) Équipement réseau qui convertit des données numériques en signaux analogiques.;
30867;méritoire;roétrmiei;˽ ˽ ˽  ˽ ˽ ˽  ˽ ˽ ˽;9;méritant;louable;estimable;digne;vertueux;Qui mérite l’approbation, l’estime.;(En particulier) (Religion) Qui rend Dieu miséricordieux pour le croyant.;
30869;nymphomane;pmnnoyhmae;˽ ˽ ˽ ˽ ˽  ˽ ˽ ˽ ˽ ˽;10;femme insatiable;hypersexuelle;;;;Atteint de nymphomanie ou relatif à la nymphomanie;(Médecine) Femme atteinte de nymphomanie.;Femme recherchant le plus possible de plaisir sexuel.
30873;pneumatique;eqiuuepmtna;˽ ˽ ˽  ˽ ˽  ˽ ˽  ˽ ˽ ˽ ˽;11;pneu;télégramme;chambre à air;pneumatologie;boyau;(Physique) Relatif à l’air.;(Technique) Qui utilise de l’air sous pression ou sous dépression.;(Spécialement) Qualifie le système de transport de petites masses, sur de courtes distances, par des tubes sous pression d’air.
30875;prénuptial;éltuapirnp;˽ ˽ ˽ ˽ ˽  ˽ ˽ ˽ ˽ ˽;10;anténuptial;;;;;Qui précède le mariage.;;
30877;testamentaire;maeietaertnts;˽ ˽ ˽  ˽ ˽ ˽  ˽  ˽ ˽ ˽  ˽ ˽ ˽;13;;;;;;Qui concerne un testament, qui a rapport à un testament.;;
30878;tolérable;rolateébl;˽ ˽ ˽  ˽ ˽ ˽  ˽ ˽ ˽;9;supportable;endurable;excusable;buvable;passable;Qu’on peut tolérer, qu’on peut supporter.;;
30879;végétatif;aiéttvéfg;˽ ˽ ˽  ˽ ˽ ˽  ˽ ˽ ˽;9;végétal;lymphatique;inactif;pâle;mou;(Botanique) (Agriculture) Relatif au développement et à la végétation des plantes.;Qualifie un mode de reproduction hors sexualité.;Qui fait végéter.
30885;appréciable;piacaébeprl;˽ ˽ ˽  ˽ ˽  ˽ ˽  ˽ ˽ ˽ ˽;11;dosable;prisable;chiffrable;évaluable;considérable;Qui peut être apprécié.;"Qui peut être apprécié par les sens ou avec le secours des procédés physiques ; dont on peut évaluer le poids, l’intensité, la durée, etc.";
30889;conceptuel;tcceonlepu;˽ ˽ ˽ ˽ ˽  ˽ ˽ ˽ ˽ ˽;10;notionnel;idéel;intellectuel;spéculatif;théorique;Relatif au concept, à l’abstraction.;;
30890;consterné;rcnoesént;˽ ˽ ˽  ˽ ˽ ˽  ˽ ˽ ˽;9;atterré;stupéfait;surpris;affligé;chagriné;Atterré, catastrophé.;Participe passé masculin singulier de consterner.;
30893;dyslexique;desqxulyie;˽ ˽ ˽ ˽ ˽  ˽ ˽ ˽ ˽ ˽;10;;;;;;Qui est atteint de dyslexie.;Personne atteinte de dyslexie.;
30894;démonstratif;tfortsdméain;˽ ˽ ˽  ˽ ˽ ˽  ˽ ˽ ˽  ˽ ˽ ˽;12;expansif;communicatif;apodictique;exubérant;concluant;Qui démontre, qui sert à démontrer.;(Rhétorique) Qui a pour objet la louange ou le blâme de tel ou tel personnage dans un discours d’apparat, dans une oraison funèbre, etc.;Qui sert à montrer.
30896;environnemental;vominreeetnnlna;˽ ˽ ˽  ˽ ˽ ˽  ˽ ˽ ˽  ˽ ˽ ˽  ˽ ˽ ˽;15;écologique;;;;;Relatif à l’environnement.;;
30900;humanoïde;nohadumïe;˽ ˽ ˽  ˽ ˽ ˽  ˽ ˽ ˽;9;;;;;;De forme humaine.;(Robotique) (Science-fiction) Robot humanoïde.;(Science-fiction) Pour les ufologues, être venu d’une autre galaxie, d’un autre univers, d’une intelligence supérieure, appelés également les anciens astronautes.
30901;illogique;luqelgioi;˽ ˽ ˽  ˽ ˽ ˽  ˽ ˽ ˽;9;aberrant;irrationnel;incohérent;paradoxal;absurde;Qui est contraire à la logique, qui manque de logique.;;
30902;incrédule;driéncelu;˽ ˽ ˽  ˽ ˽ ˽  ˽ ˽ ˽;9;athée;incroyant;irréligieux;sceptique;dubitatif;Qui ne croit que difficilement, qu’on a peine à persuader ou à convaincre.;(Religion) Qui ne croit pas et ne veut pas croire aux mystères de la foi.;Celui, celle qui ne croit pas aux choses de la foi
30904;infatigable;iaginfabetl;˽ ˽ ˽  ˽ ˽  ˽ ˽  ˽ ˽ ˽ ˽;11;increvable;endurant;agissant;résistant;robuste;Qui ne peut être fatigué par le travail, par la peine.;(Figuré) Incessant.;
30905;irréaliste;éieasitlrr;˽ ˽ ˽ ˽ ˽  ˽ ˽ ˽ ˽ ˽;10;utopique;illusoire;chimérique;;;Qui n’est pas réaliste.;;
30911;perceptible;lcepietbepr;˽ ˽ ˽  ˽ ˽  ˽ ˽  ˽ ˽ ˽ ˽;11;visible;intelligible;sensible;apparent;percevable;Qui peut être perçu.;(Spécialement) Qui peut être perçu par les sens.;(Par extension) Ce qui peut être perçu par l’esprit.
30912;proportionné;riootrnpnpéo;˽ ˽ ˽  ˽ ˽ ˽  ˽ ˽ ˽  ˽ ˽ ˽;12;harmonieux;équilibré;bien balancé;bien fait;symétrique;Participe passé masculin singulier du verbe proportionner.;;
30913;proéminent;omrnpéinte;˽ ˽ ˽ ˽ ˽  ˽ ˽ ˽ ˽ ˽;10;renflé;ballonné;bombé;gonflé;protubérant;Qui est plus en relief que ce qui l’environne.;Troisième personne du pluriel de l’indicatif présent du verbe proéminer.;Troisième personne du pluriel du subjonctif présent du verbe proéminer.
30927;déficient;ticfeéndi;˽ ˽ ˽  ˽ ˽ ˽  ˽ ˽ ˽;9;débile;malingre;insuffisant;dégénéré;anémié;(Didactique) Où il y a un manque.;Mauvais.;Personne atteinte d’une déficience sur le plan physique ou mental.
30936;intarissable;rasiblsnteai;˽ ˽ ˽  ˽ ˽ ˽  ˽ ˽ ˽  ˽ ˽ ˽;12;inépuisable;inexhaustible;inextinguible;échevelé;incessant;Qui ne peut être tari.;;
30940;massacrant;mnsraastac;˽ ˽ ˽ ˽ ˽  ˽ ˽ ˽ ˽ ˽;10;hargneux;maussade;revêche;rogue;méchant;Qui semble vouloir tout massacrer, qui est bourru, grondeur. — Note :  Il ne s’emploie guère que dans le langage familier avec le mot humeur.;Participe présent de massacrer.;
30941;naturaliste;untsralieat;˽ ˽ ˽  ˽ ˽  ˽ ˽  ˽ ˽ ˽ ˽;11;entomologiste;herpétologiste;taxidermiste;vériste;zoologiste;Qualifie un romancier partisan du naturalisme, ou une œuvre littéraire répondant aux principes du naturalisme.;Conforme au naturalisme, approche des sciences humaines selon laquelle il existe une réalité objective répondant à un certain nombre de règles (par opposition au constructivisme).;Savant qui s’applique à l’histoire naturelle, qui s’attache à l' étude des plantes, des minéraux, des animaux, etc.
30943;ombrageux;xeuamogrb;˽ ˽ ˽  ˽ ˽ ˽  ˽ ˽ ˽;9;soupçonneux;craintif;jaloux;pointilleux;méfiant;Se dit au propre des chevaux, des mulets, etc., qui sont sujets à avoir peur et à s’arrêter, ou à se jeter subitement de côté, quand ils voient leur ombre ou quelque objet qui les surprend.;(Figuré) Se dit d’une personne qui s’inquiète pour la moindre raison.;(Figuré) Qui est porté à prendre ombrage, à s’offusquer pour un rien.
30944;respirable;leiseprrab;˽ ˽ ˽ ˽ ˽  ˽ ˽ ˽ ˽ ˽;10;aéré;supportable;;;;Qu’on peut respirer.;;
30948;somnifère;neoimèfrs;˽ ˽ ˽  ˽ ˽ ˽  ˽ ˽ ˽;9;narcotique;soporifique;endormant;assommant;hypnotique;(Médecine) Qui provoque, qui cause le sommeil.;(Médecine) Substance qui fait dormir.;Première personne du singulier de l’indicatif présent de somniférer.
30951;séparatiste;itaéepasstr;˽ ˽ ˽  ˽ ˽  ˽ ˽  ˽ ˽ ˽ ˽;11;indépendantiste;sécessionniste;autonomiste;schismatique;dissident;Qui se rapporte à un mouvement dont le but est de se séparer d’un État ou d’une confédération.;(En particulier) (Canada) Qui se rapporte au séparatisme en tant qu’option politique selon laquelle le Québec devrait quitter la confédération canadienne.;Celui, celle qui se sépare, qui cherche à se séparer d’un État, d’une confédération dont il faisait partie.
30956;chatoyant;aycahtton;˽ ˽ ˽  ˽ ˽ ˽  ˽ ˽ ˽;9;miroitant;moiré;imagé;luisant;papillotant;Qui chatoie, qui semble changer de couleur, comme l’œil-de-chat, suivant les différents aspects sous lesquels il est vu, en parlant d’un objet.;Fleuri, orné.;Ce qui chatoie.
30957;colérique;oceéiulqr;˽ ˽ ˽  ˽ ˽ ˽  ˽ ˽ ˽;9;rageur;coléreux;irritable;irascible;atrabilaire;Qui est enclin à la colère.;Personnage colérique, qui s'emporte facilement.;
30958;condamnable;nnlcmbadoae;˽ ˽ ˽  ˽ ˽  ˽ ˽  ˽ ˽ ˽ ˽;11;répréhensible;coupable;blâmable;pendable;damnable;Qui mérite d’être condamné.;;
30959;coronaire;onoarreic;˽ ˽ ˽  ˽ ˽ ˽  ˽ ˽ ˽;9;coronal;coronarien;;;;Qui est disposé en couronne.;(Anatomie) Relatif aux artères disposées en rond qui partent de l’aorte et qui portent le sang dans le cœur, à la veine qui draine vers l’oreillette droite le sang qui a irrigué le cœur.;Artère disposée en rond qui part de l’aorte et qui porte le sang dans le cœur.
30960;cryogénique;reéqoniycug;˽ ˽ ˽  ˽ ˽  ˽ ˽  ˽ ˽ ˽ ˽;11;cryogène;;;;;Relatif à la cryogénie.;;
30964;facultatif;aflcttaifu;˽ ˽ ˽ ˽ ˽  ˽ ˽ ˽ ˽ ˽;10;à option;au choix;optionnel;superflu;;"Qui laisse la faculté de faire ou de ne pas faire une chose ; dont on peut, à son gré, faire ou ne pas faire usage.";;
30969;indivisible;seniiblvidi;˽ ˽ ˽  ˽ ˽  ˽ ˽  ˽ ˽ ˽ ˽;11;indissociable;insécable;indécomposable;inséparable;simple;Qui ne peut pas être divisé.;(Politique) (France) Qualifie la république qui n’est pas fédérative.;
30970;indélicat;niédcailt;˽ ˽ ˽  ˽ ˽ ˽  ˽ ˽ ˽;9;goujat;improbe;malhonnête;mufle;véreux;Qui manque de délicatesse dans les sentiments.;;
30971;interactif;tenitcfira;˽ ˽ ˽ ˽ ˽  ˽ ˽ ˽ ˽ ˽;10;conversationnel;;;;;(Informatique) Qualifie les matériels, les programmes ou les conditions d’exploitation qui permettent des actions réciproques avec des utilisateurs ou avec des appareils.;;
30972;islandais;asndiails;˽ ˽ ˽  ˽ ˽ ˽  ˽ ˽ ˽;9;;;;;;(Géographie) Relatif à l’Islande, à sa langue, à ses habitants, à sa culture.;(Linguistique) Langue parlée en Islande.;(Zoologie) Race de petit cheval de travail et cheval de selle, un poney qui forme l’unique race de cheval originaire d’Islande qui n’a pas subi de croisements depuis les années 900, très rustique, dont la taille au garrot est de 1,25 à 1,45 m, pouvant pratiquer 5 allures : le pas, le trot, le galop, l’amble et le tölt : loisir, transport, attelage, concours d’allures.
30975;opportuniste;ureiontppost;˽ ˽ ˽  ˽ ˽ ˽  ˽ ˽ ˽  ˽ ˽ ˽;12;attentiste;évolutif;terre à terre;réaliste;profiteur;Se dit d’une personne qui retourne toutes les situations en sa faveur.;Celui, celle qui est partisan de l’opportunisme.;Celui, de celle qui agit suivant les circonstances.
30979;pédophile;ipdpéehol;˽ ˽ ˽  ˽ ˽ ˽  ˽ ˽ ˽;9;pédocriminel;pédéraste;;;;Attiré sexuellement par les enfants impubères.;Adulte attiré sexuellement par les enfants.;
30982;réformiste;strieomfré;˽ ˽ ˽ ˽ ˽  ˽ ˽ ˽ ˽ ˽;10;évolutionnaire;évolutionniste;;;;Qui est partisan d’une réforme.;Partisan d’une réforme.;(En particulier) (Politique) Celui ou celle qui professe le changement social par des réformes.
30987;tuberculeux;ubxetulcuer;˽ ˽ ˽  ˽ ˽  ˽ ˽  ˽ ˽ ˽ ˽;11;phtisique;tubard;bacillaire;poitrinaire;pulmonaire;(Botanique) Qui est de la nature du tubercule.;(Médecine) Qui a rapport à la tuberculose.;(Médecine) Qui est atteint de la tuberculose.
30989;tétraplégique;earéuqtétpigl;˽ ˽ ˽  ˽ ˽ ˽  ˽  ˽ ˽ ˽  ˽ ˽ ˽;13;;;;;;Qui est atteint de tétraplégie.;Personne qui est atteinte de tétraplégie.;
30990;épidémique;déiqiumépe;˽ ˽ ˽ ˽ ˽  ˽ ˽ ˽ ˽ ˽;10;contagieux;épizootique;pandémique;endémique;viral;(Médecine) Qui tient de l’épidémie.;;
30993;avoisinant;onsniivtaa;˽ ˽ ˽ ˽ ˽  ˽ ˽ ˽ ˽ ˽;10;circonvoisin;joignant;jouxtant;limitrophe;riverain;Participe présent du verbe avoisiner.;À côté de.;
30996;correctionnel;eectnolrcoinr;˽ ˽ ˽  ˽ ˽ ˽  ˽  ˽ ˽ ˽  ˽ ˽ ˽;13;;;;;;(Droit) Qui a rapport à la correction des actes qualifiés de délits par la loi.;;
30998;divergent;vreetdngi;˽ ˽ ˽  ˽ ˽ ˽  ˽ ˽ ˽;9;différent;séparé;contradictoire;hétérogène;discordant;Qui diverge.;(Figuré) Qui va en sens contraire.;(Astronautique) (Propulsion) Partie d'une tuyère de section croissante, en aval du col, où se produit la détente du gaz.
31005;fulminant;tilfannum;˽ ˽ ˽  ˽ ˽ ˽  ˽ ˽ ˽;9;rageur;menaçant;comminatoire;détonant;grondant;Qui lance la foudre, qui est armé de la foudre.;(Chimie) Certaines compositions qui détonent ou éclatent quand on les chauffe ou qu’on les comprime.;(Figuré) Qui est chargé de menaces ou qui dénote une violente colère.
31007;harmonique;uomeqhiarn;˽ ˽ ˽ ˽ ˽  ˽ ˽ ˽ ˽ ˽;10;diatonique;harmonieux;harmonie;;;(Musique) Qui a rapport à l’harmonie.;(Acoustique) Tons apparentés entre eux, l’un ayant engendré les autres et tous présentant alors entre eux des relations déterminées de hauteur.;(Mathématiques) Trois nombres sont en proportion harmonique quand le quotient entre le premier et le second est égal au quotient entre le second et le troisième.
31008;imparable;leiabrmap;˽ ˽ ˽  ˽ ˽ ˽  ˽ ˽ ˽;9;inévitable;implacable;;;;Qui ne peut être paré, contredit, opposé.;;
31010;intentionné;innéittonen;˽ ˽ ˽  ˽ ˽  ˽ ˽  ˽ ˽ ˽ ˽;11;;;;;;Qui a certaine intention. Note :  Il s’emploie surtout avec bien ou avec mal.;;
31011;invivable;nbvavieil;˽ ˽ ˽  ˽ ˽ ˽  ˽ ˽ ˽;9;insupportable;impossible;inhabitable;intenable;intolérable;"Avec qui on ne peut vivre ; impossible à vivre.";Insupportable.;Pénible, à propos d’une situation difficile ou impossible à supporter
31014;mythomane;onahmetym;˽ ˽ ˽  ˽ ˽ ˽  ˽ ˽ ˽;9;affabulateur;fabulant;fabulateur;bluffeur;vantard;(Médecine) Qui a la manie pathologique de l’invention mensongère.;(Par extension) Qui ment, qui fabule.;Qui est en rapport avec la mythomanie.
31016;phallique;pllaqiuhe;˽ ˽ ˽  ˽ ˽ ˽  ˽ ˽ ˽;9;ithyphallique;pénien;priapique;;;Relatif au phallus.;;
31017;prémonitoire;mpoternioiér;˽ ˽ ˽  ˽ ˽ ˽  ˽ ˽ ˽  ˽ ˽ ˽;12;avant-coureur;;;;;Qui avertit d’avance.;(Médecine) Qualifie un signe ou une période qui précède l’apparition d’une maladie.;
31021;récupérable;rraubélépec;˽ ˽ ˽  ˽ ˽  ˽ ˽  ˽ ˽ ˽ ˽;11;rattrapable;;;;;Qui peut être récupéré.;;
31024;unilatéral;uaatéllinr;˽ ˽ ˽ ˽ ˽  ˽ ˽ ˽ ˽ ˽;10;manichéen;partial;sectaire;;;Relatif à un seul côté.;;
31028;antécédent;éactdnetén;˽ ˽ ˽ ˽ ˽  ˽ ˽ ˽ ˽ ˽;10;antérieur;préexistant;enthymème;précédent;préalable;Qui précède dans l’ordre du temps.;Ce qui précède dans le temps.;(Grammaire) Nom, d’un pronom ou d’une proposition qui est déterminée par une proposition relative.
31029;attendrissant;rdsstaianntet;˽ ˽ ˽  ˽ ˽ ˽  ˽  ˽ ˽ ˽  ˽ ˽ ˽;13;bouleversant;émouvant;touchant;pitoyable;poignant;Qui attendrit, qui émeut de compassion, de tendresse.;Participe présent de attendrir.;
31030;bouillonnant;ntnonaoliblu;˽ ˽ ˽  ˽ ˽ ˽  ˽ ˽ ˽  ˽ ˽ ˽;12;ardent;bouillant;fougueux;chaud;enthousiaste;Qui bouillonne.;Participe présent du verbe bouillonner.;
31032;bricoleur;bicorlure;˽ ˽ ˽  ˽ ˽ ˽  ˽ ˽ ˽;9;combinard;affairiste;spéculateur;bricolier;bibeloteur;Celui, celle qui bricole.;;
31033;calculateur;uculaaetlrc;˽ ˽ ˽  ˽ ˽  ˽ ˽  ˽ ˽ ˽ ˽;11;chiffreur;calculatrice;calculette;boulier;manipulateur;Qui calcule, qui a pour habitude de prévoir et d’anticiper.;Homme qui s’occupe de calcul.;Homme qui calcule beaucoup pour arriver à ses fins.
31037;corrompre;rprrmoeco;˽ ˽ ˽  ˽ ˽ ˽  ˽ ˽ ˽;9;gâter;dépraver;altérer;pervertir;dénaturer;Gâter, altérer, changer en mal.;Séduire, débaucher.;(Par extension) Engager quelqu'un par des dons, des promesses, ou par d'autres moyens, à faire quelque chose contre son devoir, sa conscience, contre l'honneur, etc.
31039;désopilant;néalstipdo;˽ ˽ ˽ ˽ ˽  ˽ ˽ ˽ ˽ ˽;10;hilarant;poilant;tordant;bidonnant;gondolant;(Par ellipse) Qui fait beaucoup rire.;Participe présent de désopiler.;
31040;exécutoire;tieoxécure;˽ ˽ ˽ ˽ ˽  ˽ ˽ ˽ ˽ ˽;10;issue;;;;;(Droit) Qui peut être mis à exécution, ou qui donne pouvoir de procéder à une exécution judiciaire.;(Droit) Acte qui donne pouvoir de contraindre au paiement des frais et dépens, selon les formes judiciaires.;
31041;fatidique;udetiaiqf;˽ ˽ ˽  ˽ ˽ ˽  ˽ ˽ ˽;9;inéluctable;inévitable;fatal;immanquable;accablant;Qui révèle ce que les destins ont ordonné.;;
31043;formateur;rouframet;˽ ˽ ˽  ˽ ˽ ˽  ˽ ˽ ˽;9;éducatif;pédagogique;instructif;façonneur;formatif;(Didactique) Personne qui forme, qui donne forme à quelque chose.;(Éducation) Personne qui instruit les autres en leur en donnant une formation.;(Politique) Personne qui consulte les partis politiques ayant remportés les élections afin de former un gouvernement.
31045;immatériel;almrémitei;˽ ˽ ˽ ˽ ˽  ˽ ˽ ˽ ˽ ˽;10;éthéré;impalpable;platonique;incorporel;surnaturel;Qui est sans aucun mélange de matière.;Qui semble ne pas être fait de matière.;Dont la réalité n'est pas tangible.
31046;indisposé;énsdiopis;˽ ˽ ˽  ˽ ˽ ˽  ˽ ˽ ˽;9;malintentionné;mécontent;patraque;incommodé;souffrant;Qui est affecté d’une indisposition.;(En particulier) Se dit par litote d'une femme qui a ses règles.;Participe passé masculin singulier de indisposer.
31047;inventeur;uievnetrn;˽ ˽ ˽  ˽ ˽ ˽  ˽ ˽ ˽;9;créateur;innovateur;fondateur;novateur;fabricant;Personne qui a fait une ou plusieurs inventions entérinées par un brevet d’invention.;(Par extension) Créateur, qui renouvelle, augmente ou modifie la science ou l’art.;Auteur qui affabule.
31050;montagnard;grnmatnado;˽ ˽ ˽ ˽ ˽  ˽ ˽ ˽ ˽ ˽;10;alpiniste;montagneux;habitant;;;(Géographie) Qui habite les montagnes.;Relatif à Jeansagnière, commune de la Loire.;Relatif à La Montagne, commune de la Loire-Atlantique.
31051;multicolore;luoicemlrot;˽ ˽ ˽  ˽ ˽  ˽ ˽  ˽ ˽ ˽ ˽;11;versicolore;omnicolore;polychrome;chamarré;bariolé;Qui est de plusieurs couleurs.;Première personne du singulier de l’indicatif présent de multicolorer.;Troisième personne du singulier de l’indicatif présent de multicolorer.
31052;mégalomane;maoénelmga;˽ ˽ ˽ ˽ ˽  ˽ ˽ ˽ ˽ ˽;10;ambitieux;prétentieux;orgueilleux;;;Qui est atteint de mégalomanie.;Personne atteinte de la folie des grandeurs.;
31054;parabolique;eiqaaloprub;˽ ˽ ˽  ˽ ˽  ˽ ˽  ˽ ˽ ˽ ˽;11;;;;;;(Géométrie) Qui a la forme d’une parabole.;(Rhétorique) Qui évoque une parabole, qui s'y rapporte ou qui en a la forme.;
31058;quadruple;pdlquuear;˽ ˽ ˽  ˽ ˽ ˽  ˽ ˽ ˽;9;;;;;;La quantité quatre fois plus grande.;(Histoire) Pièce d'or qui valait quatre fois la valeur d'une simple.;Qui vaut quatre fois autant.
31059;recommandable;cmloemrabaned;˽ ˽ ˽  ˽ ˽ ˽  ˽  ˽ ˽ ˽  ˽ ˽ ˽;13;fréquentable;louable;estimable;;;"Qui est estimable ; qui mérite d’être considéré.";;
31064;visionnaire;ianirvsneio;˽ ˽ ˽  ˽ ˽  ˽ ˽  ˽ ˽ ˽ ˽;11;songe-creux;inspiré;prophète;voyant;devin;Qui a suffisamment d’influence pour que ses idées soient reprises dans le futur.;(Désuet) Qui a, qui croit avoir des visions, des révélations.;(Désuet) (Figuré) Qui a des idées folles, des imaginations extravagantes, des desseins chimériques.
31066;accommodant;tamccondmoa;˽ ˽ ˽  ˽ ˽  ˽ ˽  ˽ ˽ ˽ ˽;11;complaisant;facile;conciliant;coulant;commode;Qui s’accommode à tous et à tout.;Participe présent du verbe accommoder.;
31067;admiratif;iaaidrtfm;˽ ˽ ˽  ˽ ˽ ˽  ˽ ˽ ˽;9;extasié;admirant;adoratif;impressionné;pâmé;Qui exprime l’admiration.;Se dit du ton, des gestes.;
31068;antipersonnel;lnieetnnsoapr;˽ ˽ ˽  ˽ ˽ ˽  ˽  ˽ ˽ ˽  ˽ ˽ ˽;13;;;;;;(Militaire) Dirigé contre les personnes, destiné à tuer ou invalider soldats ou civils.;;
