Id;lemme;anagramme;nb_lettres;nb_lettres2;syn_1;syn_2;syn_3;syn_4;syn_5;def_1;def_2;def_3
6015;présomption;otéprnompsi;˽ ˽ ˽  ˽ ˽  ˽ ˽  ˽ ˽ ˽ ˽;11;conjecture;supposition;fatuité;outrecuidance;prétention;Jugement, conjecture, fondé non sur des preuves, mais sur des indices, des apparences, sur ce qui est probable sans être certain.;(Droit) Ce qui est supposé vrai jusqu’à preuve du contraire.;Opinion trop avantageuse de soi-même.
6017;turbulence;btneucelur;˽ ˽ ˽ ˽ ˽  ˽ ˽ ˽ ˽ ˽;10;effervescence;remue-ménage;tohu-bohu;tumulte;animation;Caractère de celui qui est turbulent.;(Physique) État d’un fluide, liquide ou gaz, dans lequel la vitesse présente en tout point un caractère tourbillonnaire.;
6018;visionnaire;oieavsrinni;˽ ˽ ˽  ˽ ˽  ˽ ˽  ˽ ˽ ˽ ˽;11;songe-creux;inspiré;prophète;voyant;devin;Qui a suffisamment d’influence pour que ses idées soient reprises dans le futur.;(Désuet) Qui a, qui croit avoir des visions, des révélations.;(Désuet) (Figuré) Qui a des idées folles, des imaginations extravagantes, des desseins chimériques.
6021;carrosserie;asrsroeirec;˽ ˽ ˽  ˽ ˽  ˽ ˽  ˽ ˽ ˽ ˽;11;carrossage;tôlerie;carénage;bâti;caisse;"(Désuet) Fabrique de voitures ; industrie de la fabrication des voitures.";Ensemble des pièces d'une automobile qui n’appartiennent ni à la mécanique, ni au châssis.;(En particulier) Coquille rigide d'une automobile qui enveloppe les passagers et la mécanique de celle-ci.
6022;compression;snpeomocisr;˽ ˽ ˽  ˽ ˽  ˽ ˽  ˽ ˽ ˽ ˽;11;aplatissement;constriction;restriction;resserrement;contraction;Action de comprimer ou résultat de cette action.;(Figuré) Oppression.;(Sport) Phénomène d’écrasement du corps qui est ressenti par un sportif lorsqu’il atteint, à vitesse élevée, le point où une pente descendante s’inverse brutalement.
6023;disjoncteur;enrosiudjtc;˽ ˽ ˽  ˽ ˽  ˽ ˽  ˽ ˽ ˽ ˽;11;rupteur;sectionneur;interrupteur;fermeture;;(Électricité) Organe de protection électromécanique, voire électronique, dont la fonction est d’interrompre le courant électrique en cas de surcharge, ou d'anomalie sur un circuit électrique.;;
6029;inquisiteur;niuretiuqsi;˽ ˽ ˽  ˽ ˽  ˽ ˽  ˽ ˽ ˽ ˽;11;fureteur;fouinard;fouineur;investigateur;inquisitif;Qui cherche à s’enquérir avec une curiosité souvent indiscrète.;Juge de l’Inquisition.;Magistrat de la république de Venise qui était chargé de découvrir et de prévenir les complots formés contre le gouvernement.
6031;irresponsabilité;raosreénliisbipt;˽ ˽ ˽ ˽  ˽ ˽ ˽ ˽  ˽ ˽ ˽ ˽  ˽ ˽ ˽ ˽;16;immunité;;;;;Qualité de ce qui est irresponsable.;Dans les gouvernements parlementaires, doctrine, loi qui ôte toute responsabilité au souverain et la reporte tout entière sur ses ministres.;
6034;nationaliste;eniiasotntal;˽ ˽ ˽  ˽ ˽ ˽  ˽ ˽ ˽  ˽ ˽ ˽;12;chauvin;patriote;patriotard;superpatriote;xénophobe;Qui se rapporte au nationalisme.;Personne qui professe le nationalisme.;
6038;évangéliste;evgténléasi;˽ ˽ ˽  ˽ ˽  ˽ ˽  ˽ ˽ ˽ ˽;11;évangélisateur;prêcheur;missionnaire;protestant;;(Religion) Auteur de l’un des quatre évangiles, dans la religion chrétienne.;(Religion) Personne qui pratique l’évangélisation.;"Relatif à l’évangélisation ; qui permet, préconise ou a pour but l’évangélisation."
6039;aubergine;ngeurieba;˽ ˽ ˽  ˽ ˽ ˽  ˽ ˽ ˽;9;morelle;violet;;;;(Botanique) Plante herbacée de la famille des solanacées qui porte des fruits blancs semblables à des œufs, ou de forme allongée comme les concombres, et de couleur violette, jaune ou rougeâtre (Solanum melongena).;(Botanique) Fruit de cette plante, de couleur magenta-pourpre à violet, très sombre, de la famille des solanacées, utilisé comme légume, notamment dans la cuisine méditerranéenne, et servant à réaliser des plats tels que la moussaka ou la ratatouille.;(Par analogie) (France) (Argot) Auxiliaire féminine de police, chargée du contrôle du stationnement, appelée ainsi à l’origine en raison de la couleur de son uniforme, proche de celle du fruit.
6042;cinquantaine;ianicenqaunt;˽ ˽ ˽  ˽ ˽ ˽  ˽ ˽ ˽  ˽ ˽ ˽;12;;;;;;(Terme collectif) Assemblage de choses de même nature au nombre de cinquante environ.;Âge de cinquante ans.;(Dans la cinquantaine) Âges de 50 à 59 ans.
6044;documentation;mdttaonecuoni;˽ ˽ ˽  ˽ ˽ ˽  ˽  ˽ ˽ ˽  ˽ ˽ ˽;13;descriptif;mode d'emploi;notice;description;document;Ensemble de documents recueillis sur une question.;Action de consulter des documents.;(Au pluriel) (Rare) Document.
6045;détonation;otdtannioé;˽ ˽ ˽ ˽ ˽  ˽ ˽ ˽ ˽ ˽;10;déflagration;coup de feu;fulmination;pétarade;éclatement;Explosion violente et subite accompagnée de bruit, telle que celle de la poudre à canon.;;
6052;pénicilline;pieininlléc;˽ ˽ ˽  ˽ ˽  ˽ ˽  ˽ ˽ ˽ ˽;11;;;;;;(Pharmacologie) Antibiotique bêta-lactamine produit par des champignons du genre Penicillium.;;
6057;suspicion;ioincspus;˽ ˽ ˽  ˽ ˽ ˽  ˽ ˽ ˽;9;méfiance;défiance;doute;soupçon;crainte;"Soupçon ; action de tenir pour suspect.";;
6067;contrebandier;cnbredaieontr;˽ ˽ ˽  ˽ ˽ ˽  ˽  ˽ ˽ ˽  ˽ ˽ ˽;13;bandolier;bootlegger;passeur;;;Relatif à la contrebande.;Personne faisant de la contrebande, qui passe des objets en dehors des formalités et taxes d'une frontière, et qui est pourchassée par les douaniers.;
6068;contretemps;enrtcetsmpo;˽ ˽ ˽  ˽ ˽  ˽ ˽  ˽ ˽ ˽ ˽;11;anicroche;accroc;empêchement;incident;complication;Accident inopiné qui nuit au succès d’une affaire et qui rompt les mesures qu’on avait prises.;(Danse) Certain pas.;(Musique) Syncope, action d’appuyer sur le temps faible d’une mesure et de passer plus ou moins légèrement sur le temps fort.
6070;familiarité;maltéiiraif;˽ ˽ ˽  ˽ ˽  ˽ ˽  ˽ ˽ ˽ ˽;11;privauté;intimité;désinvolture;caresse;liberté;Manière de vivre dans l’intimité de quelqu’un.;(Surtout au pluriel) Manière de se comporter trop librement à l’égard d’une personne.;(Par extension) Simplicité, en parlant des ouvrages de l’esprit.
6074;pardessus;edasusrsp;˽ ˽ ˽  ˽ ˽ ˽  ˽ ˽ ˽;9;pardingue;paletot;pelisse;manteau;;(Habillement) Vêtement qu’on met sur les autres pour se garantir du froid ou de l’humidité.;;
6076;patrouilleur;aptruliorleu;˽ ˽ ˽  ˽ ˽ ˽  ˽ ˽ ˽  ˽ ˽ ˽;12;garde;surveillant;soldat;;;(Militaire) Soldat envoyé en patrouille.;(Navigation) Petit bâtiment de guerre employé pour des reconnaissances, des surveillances.;(Jargon des wikis) Personne qui consacre une partie de son temps à vérifier que les modifications effectuées sont acceptables, et qui les annule si elles ne le sont pas.
6077;rescousse;ceessuros;˽ ˽ ˽  ˽ ˽ ˽  ˽ ˽ ˽;9;coup d'épaule;concours;main-forte;assistance;secours;(Vieilli) Aide, secours.;;
6081;secrétariat;riscaetatér;˽ ˽ ˽  ˽ ˽  ˽ ˽  ˽ ˽ ˽ ˽;11;chancellerie;secrétairerie;services;administration;bureau;Emploi, fonction de secrétaire.;Lieu où se tient le secrétaire d’une administration, d’une compagnie, etc.;(Par métonymie) Organisation d’assistance administrative.
6083;thermomètre;omtmrehtère;˽ ˽ ˽  ˽ ˽  ˽ ˽  ˽ ˽ ˽ ˽;11;baromètre;;;;;(Métrologie) Instrument de mesure indiquant la température, généralement par le moyen de la dilatation ou de la condensation de gaz ou de liquides enfermés dans un tube de verre.;(Par métonymie) Colonne du liquide dont la dilatation est utilisée pour évaluer la température.;(Par métonymie) La température elle-même. Synonyme : mercure.
6085;tournesol;tnolrsuoe;˽ ˽ ˽  ˽ ˽ ˽  ˽ ˽ ˽;9;hélianthe;colorant;soleil;bleu;;(Botanique) Nom vernaculaire d’une espèce d’héliotrope (Heliotropus sp.).;(Botanique) Synonyme d’hélianthe, genre de la familles des Asteracées.;(Courant) (Botanique) (Agriculture) Helianthus annuus, espèce d’hélianthe à très grandes fleurs. Ses graines oléagineuses sont utilisées dans l’alimentation et ses fleurs comme ornement.
6090;archéologie;gléoriheoac;˽ ˽ ˽  ˽ ˽  ˽ ˽  ˽ ˽ ˽ ˽;11;antiquité;fouille;histoire;;;Science des arts et des monuments anciens, et de la recherche d’éléments anciens, en particulier par la fouille.;;
6091;auxiliaire;aiilxiauer;˽ ˽ ˽ ˽ ˽  ˽ ˽ ˽ ˽ ˽;10;adjoint;second;assesseur;contractuel;associé;Qui aide, dont on tire du secours.;(Militaire) (Vieilli) Qualifiait un soldat du contingent qui est utilisé dans un des services autres que le service armé, par suite de sa faiblesse de constitution.;(Figuré) Peu important, secondaire.
6092;brancardier;cniarrardeb;˽ ˽ ˽  ˽ ˽  ˽ ˽  ˽ ˽ ˽ ˽;11;ambulancier;limonier;secouriste;infirmier;soldat;Celui qui porte un brancard.;(Vieilli) Cheval attelé entre les deux brancards.;
6097;catapulte;ulectapta;˽ ˽ ˽  ˽ ˽ ˽  ˽ ˽ ˽;9;baliste;mangonneau;scorpion;onagre;machine;(Histoire) (Militaire) Machine de guerre dont les anciens se servaient pour lancer des pierres ou des traits.;(Militaire) Engin qui sert à lancer un avion, à partir d’un porte-avions.;Première personne du singulier de l’indicatif présent du verbe catapulter.
6099;créancier;irerncaéc;˽ ˽ ˽  ˽ ˽ ˽  ˽ ˽ ˽;9;bailleur;fesse-mathieu;;;;Personne qui a prêté de l’argent, ou un bien, à une personne qui devient le débiteur.;;
6101;féministe;ntefsméii;˽ ˽ ˽  ˽ ˽ ˽  ˽ ˽ ˽;9;suffragette;;;;;Qui a rapport au féminisme, mouvement revendicatif ayant pour objet la reconnaissance ou l’extension des droits des femmes dans la société. ;Activiste du féminisme.;
6110;schilling;glisncihl;˽ ˽ ˽  ˽ ˽ ˽  ˽ ˽ ˽;9;;;;;;Monnaie de l'Autriche avant l'euro, et de divers autres pays.;;
6120;harmonica;nraihacom;˽ ˽ ˽  ˽ ˽ ˽  ˽ ˽ ˽;9;;;;;;Instrument de musique composé de cloches ou de verres, de différents timbres, qu’on fait résonner.;Instrument à touches où le verre remplace les cordes de métal.;Instrument de musique à bouche comportant des anches métalliques.
6122;magnétisme;agéitmemsn;˽ ˽ ˽ ˽ ˽  ˽ ˽ ˽ ˽ ˽;10;hypnose;hypnotisme;envoûtement;mesmérisme;fascination;Partie de la physique qui regroupe les propriétés des aimants et des champs magnétiques.;Doctrine dont les partisans croyaient qu’on peut produire sur le corps humain, par des attouchements ou par des passes, des impressions propres à guérir les maladies.;(Figuré) Ce qui semble produire un tel effet.
6125;promoteur;etromopru;˽ ˽ ˽  ˽ ˽ ˽  ˽ ˽ ˽;9;instigateur;initiateur;créateur;animateur;moteur;Personne qui promeut un service ou un bien.;(Littéraire) Personne qui donne la première impulsion à quelque chose, qui en provoque la création, la réalisation.;(Génétique) Séquence d’ADN nécessaire à l’initiation de la transcription et le plus souvent située en amont de la partie transcrite des gènes.
6135;attribution;ttinrabituo;˽ ˽ ˽  ˽ ˽  ˽ ˽  ˽ ˽ ˽ ˽;11;allocation;quota;commission;répartition;apport;Action d’attribuer.;Droits que possède une personne chargée de quelque fonction ou qui sont attachés à la fonction elle-même.;
6136;autoradio;ouartdiao;˽ ˽ ˽  ˽ ˽ ˽  ˽ ˽ ˽;9;;;;;;(Automobile) Poste de radio conçu pour fonctionner à bord d’une automobile.;;
6139;confessionnal;liocaonssnefn;˽ ˽ ˽  ˽ ˽ ˽  ˽  ˽ ˽ ˽  ˽ ˽ ˽;13;;;;;;(Religion) Édicule disposé pour que le prêtre entende le pénitent en confession.;;
6141;expéditeur;uéritexedp;˽ ˽ ˽ ˽ ˽  ˽ ˽ ˽ ˽ ˽;10;consignateur;envoyeur;destinateur;expéditionnaire;exportateur;Personne qui envoie un objet, un message, par la poste, par messagerie, par camion, par chemin de fer, par bateau, par avion ou par tout autre moyen.;Relatif à l'expédition.;
6142;flatterie;iltefrate;˽ ˽ ˽  ˽ ˽ ˽  ˽ ˽ ˽;9;adulation;flagornerie;encens;servilité;compliment;Louange fausse ou exagérée, donnée dans le dessein de plaire, de séduire, d’exploiter.;;
6145;infidélité;itinédiélf;˽ ˽ ˽ ˽ ˽  ˽ ˽ ˽ ˽ ˽;10;trahison;inconstance;adultère;traîtrise;malhonnêteté;"Manque de fidélité ; manquement à ses devoirs.";(Par extension) Actes d’infidélité.;Manque d’exactitude, de vérité, en parlant des personnes et des choses.
6146;insuffisance;enainifsuscf;˽ ˽ ˽  ˽ ˽ ˽  ˽ ˽ ˽  ˽ ˽ ˽;12;manque;déficience;carence;imperfection;défaut;État de ce qui est insuffisant.;Infériorité, inaptitude, de certaines personnes pour certaines choses.;Dysfonctionnement.
6147;insurrection;nrtisnuoreic;˽ ˽ ˽  ˽ ˽ ˽  ˽ ˽ ˽  ˽ ˽ ˽;12;émeute;mutinerie;soulèvement;sédition;révolte;Soulèvement contre un pouvoir établi ou une autorité arbitraire.;;
6151;projectile;etoiercplj;˽ ˽ ˽ ˽ ˽  ˽ ˽ ˽ ˽ ˽;10;obus;fusée;bombe;boulet;cartouche;(Didactique) Tout corps lancé par une force quelconque.;(En particulier) (Armement) Balle, obus, et en général de tout corps lancé par une arme de jet ou une arme à feu.;
6152;prévention;poétennrvi;˽ ˽ ˽ ˽ ˽  ˽ ˽ ˽ ˽ ˽;10;allergie;préjugé;antipathie;idée préconçue;arrestation;Action de prévenir, mesure à prendre pour prévenir certains risques.;Opinion préconçue, favorable ou défavorable, antérieure à tout raisonnement ou examen.;(Droit) État d’un homme prévenu de délit, de crime.
6155;régisseur;iueérrgss;˽ ˽ ˽  ˽ ˽ ˽  ˽ ˽ ˽;9;administrateur;gérant;gestionnaire;intendant;économe;Personne qui régit, qui gère par commission et a la charge de rendre compte.;(En particulier) Personne qui régit et gère un domaine pour le compte d’autrui.;(En particulier) (Théâtre) Employé chargé particulièrement de veiller à tous les détails matériels de la représentation.
6157;éjaculation;jnotcléuiaa;˽ ˽ ˽  ˽ ˽  ˽ ˽  ˽ ˽ ˽ ˽;11;déjection;éjection;miction;orgasme;projection;(Physiologie) Action d’éjaculer.;(Religion) Prière fervente, et qui part du cœur.;
6161;dévergondé;évroegddén;˽ ˽ ˽ ˽ ˽  ˽ ˽ ˽ ˽ ˽;10;libertin;dissolu;déréglé;impudique;débauché;Qui mène une vie de dévergondage.;Qui montre du dévergondage.;Personne qui s’adonne au dévergondage. 
6165;moisissure;ssrouiemis;˽ ˽ ˽ ˽ ˽  ˽ ˽ ˽ ˽ ˽;10;chancissure;champignon;ferment;pourriture;décomposition;(Mycologie) Champignons microscopiques qui vivent en formant des végétations ramifiées à la surface des matières organiques dont ils provoquent la fermentation, la décomposition.;Endroit moisi, le moisi.;
6166;pirouette;rtiopeeut;˽ ˽ ˽  ˽ ˽ ˽  ˽ ˽ ˽;9;volte-face;cabriole;acrobatie;revirement;voltigement;(Danse) Tour entier qu’on fait de tout le corps, en se tenant sur la pointe d’un seul pied.;(Équitation) Sorte de volte que fait le cheval sur sa longueur dans une seule et même place.;(Figuré) Dérobade.
6167;probation;rotipaonb;˽ ˽ ˽  ˽ ˽ ˽  ˽ ˽ ˽;9;noviciat;sursis;;;;(Vieilli) Épreuve.;(Religion) Temps du noviciat, dans certains ordres religieux, parce qu’on y éprouve les novices avant de les recevoir à faire profession.;(Par extension) Temps d’épreuve qui précède le noviciat.
6168;ronflement;tomrenefnl;˽ ˽ ˽ ˽ ˽  ˽ ˽ ˽ ˽ ˽;10;vrombissement;ronron;bourdonnement;grondement;ronronnement;Bruit qu’on fait en ronflant.;(Figuré) Se dit de certains bruits qui ont quelque rapport avec le ronflement d’un homme.;(Astronautique) (Propulsion) Phénomène sonore transitoire, d’une fréquence de quelques dizaines de hertz, qui correspond à l’oscillation de la pression de combustion dans un moteur à ergols liquides en phase d’extinction.
6171;échographie;éepigchorha;˽ ˽ ˽  ˽ ˽  ˽ ˽  ˽ ˽ ˽ ˽;11;échotomographie;ultrasonographie;;;;Technique d'imagerie employant des ultrasons utilisée en médecine, en exploration vétérinaire ou dans l’industrie.;Image qui en découle.;Première personne du singulier de l’indicatif présent de échographier.
6172;cachemire;ircaemech;˽ ˽ ˽  ˽ ˽ ˽  ˽ ˽ ˽;9;;;;;;(Industrie textile) Relatif aux poils de la chèvre du Cachemire.;Textile naturel, laine de poils très fins issus de la chèvre du Cachemire.;(Par extension) Un châle de cette laine.
6175;controverse;stnorvcoere;˽ ˽ ˽  ˽ ˽  ˽ ˽  ˽ ˽ ˽ ˽;11;polémique;débat;litige;contestation;discussion;Débat sur une question, sur une opinion, etc. suscité par des avis divergents.;(En particulier) (Religion) Dispute qui a pour objet des points de foi.;Première personne du singulier de l’indicatif présent de controverser.
6176;cornemuse;muesrcnoe;˽ ˽ ˽  ˽ ˽ ˽  ˽ ˽ ˽;9;cabrette;biniou;bagpipe;chabrette;chevrie;(Musique) instrument de musique à vent, composé de tuyaux et d’une outre formée d’une peau de mouton, qu’on enfle grâce au premier tuyau appelé porte-vent.;Première personne du singulier de l’indicatif présent de cornemuser.;Troisième personne du singulier de l’indicatif présent de cornemuser.
6181;hémisphère;reièémshhp;˽ ˽ ˽ ˽ ˽  ˽ ˽ ˽ ˽ ˽;10;coupole;calotte;;;;(Didactique) Moitié d’une sphère.;(En particulier) (Géographie) Une des moitiés du globe terrestre.;(Anatomie) Moitié droite ou gauche du cerveau.
6185;multitude;leiudttmu;˽ ˽ ˽  ˽ ˽ ˽  ˽ ˽ ˽;9;foule;affluence;quantité;masse;flot;Grand nombre.;(Absolument) (Péjoratif) La masse du peuple.;
6186;négociateur;éitonruegac;˽ ˽ ˽  ˽ ˽  ˽ ˽  ˽ ˽ ˽ ˽;11;ambassadeur;envoyé;médiateur;émissaire;représentant;Celui, celle qui négocie quelque affaire importante, publique ou privée.;Psychologue spécialisé dans le dialogue avec les preneurs d’otages, avec pour mission principale la libération des otages et la reddition du preneur d’otage.;
6191;renouveau;uearvouen;˽ ˽ ˽  ˽ ˽ ˽  ˽ ˽ ˽;9;renaissance;regain;réveil;retour;renouvellement;"Retour du printemps ; début du printemps.";;
6192;résistant;rtéintssa;˽ ˽ ˽  ˽ ˽ ˽  ˽ ˽ ˽;9;solide;tenace;robuste;inébranlable;coriace;"Qui oppose de la résistance ; qui est solide.";D'une santé solide, qui résiste aux maladies, aux infections.;(Électricité) Qui est doté d'une résistance électrique.
6193;sauveteur;sereuutav;˽ ˽ ˽  ˽ ˽ ˽  ˽ ˽ ˽;9;secoureur;terre-neuve;secouriste;sauveur;;Celui qui prend part à un sauvetage.;(Par apposition) Un bateau sauveteur, Une embarcation employée au sauvetage.;
6202;horizontale;niealoohztr;˽ ˽ ˽  ˽ ˽  ˽ ˽  ˽ ˽ ˽ ˽;11;fille légère;prostitué;;;;Féminin singulier de horizontal.;Orientation sur le plan perpendiculaire à la direction du poids (force de pesanteur).;(Sexualité) (Vieilli) Courtisane.
6203;illustration;onlrltiatsui;˽ ˽ ˽  ˽ ˽ ˽  ˽ ˽ ˽  ˽ ˽ ˽;12;gloire;réputation;célébrité;gravure;estampe;(Vieilli) Action d’illustrer ou état de ce qui est illustre.;(Vieilli) (Par extension) Personnage célèbre.;"Exemple qui rend plus évident et plus clair ; explication."
6204;intendance;ennenacidt;˽ ˽ ˽ ˽ ˽  ˽ ˽ ˽ ˽ ˽;10;économat;questure;gestion;logistique;administration;Fonction d’un intendant.;(Militaire) Corps chargé de tout ce qui concerne l’administration et la comptabilité de l’armée.;Endroit où sont les bureaux de celui qui remplit la fonction d’intendant.
6207;patinoire;natprioei;˽ ˽ ˽  ˽ ˽ ˽  ˽ ˽ ˽;9;;;;;;Surface d'eau glacée sur laquelle on peut faire du patinage ou du hockey sur glace.;(Par extension) Bâtiment abritant la surface d'eau glacée et doté de gradins.;Aire de jeu d’un théâtre ou d’un match d’improvisation.
6211;rendement;ntrneemed;˽ ˽ ˽  ˽ ˽ ˽  ˽ ˽ ˽;9;productivité;produit;efficacité;efficience;fertilité;Ce que rend, ce que produit une chose.;(En particulier) (Agriculture) Production récoltée sur une culture relativement à la surface cultivée.;(En particulier) (Fiscalité) Ce que rapportent les impôts.
6217;connaisseur;rscianunsoe;˽ ˽ ˽  ˽ ˽  ˽ ˽  ˽ ˽ ˽ ˽;11;gourmet;appréciateur;bec fin;expert;amateur;(Arts) Celui qui se connaît à diverses choses dans un domaine donné, notamment les beaux-arts ou la gastronomie.;;
6218;coordination;dnoritoonaic;˽ ˽ ˽  ˽ ˽ ˽  ˽ ˽ ˽  ˽ ˽ ˽;12;timing;copule;synchronisation;agencement;harmonisation;Action de coordonner qui permet, facilite et ordonne à des entités à travailler ensemble.;Résultat de cette action qui amène des entités à travailler ensemble de bon ou de mal gré.;(Spécialement) Action de coordonner des mouvements corporels.
6221;lansquenet;aetesnqnul;˽ ˽ ˽ ˽ ˽  ˽ ˽ ˽ ˽ ˽;10;bassette;jeu de cartes;;;;Fantassin mercenaire, dans les anciennes armées germaniques (XVe et XVIe siècle).;Sorte de jeu de hasard que l’on joue avec des cartes.;
6227;souteneur;uorutnees;˽ ˽ ˽  ˽ ˽ ˽  ˽ ˽ ˽;9;maquereau;marlou;fauteur;proxénète;alphonse;Celui qui, vivant du gain d’une prostituée, prétend assurer, en retour, sa protection.;;
6228;anticorps;sipnotacr;˽ ˽ ˽  ˽ ˽ ˽  ˽ ˽ ˽;9;agglutinine;anti-enzyme;auto-anticorps;hémolysine;lysine;(Biologie) Glycoprotéine complexe utilisée par le système immunitaire pour détecter et neutraliser les agents pathogènes comme les bactéries et les virus.;;
6231;baraquement;bnauqmtraee;˽ ˽ ˽  ˽ ˽  ˽ ˽  ˽ ˽ ˽ ˽;11;caserne;cantonnement;casernement;cagna;baraque;(Militaire) Action de baraquer.;Ensemble de baraques plus ou moins grandes destinées à servir de logement provisoire à des groupes d’individus.;
6237;incendiaire;iidniaceern;˽ ˽ ˽  ˽ ˽  ˽ ˽  ˽ ˽ ˽ ˽;11;pétroleuse;pyromane;brûleur;boutefeu;chauffeur;Qui cause, qui peut causer un incendie.;(Par analogie) Définition manquante ou à compléter. (Ajouter).;(Figuré) Qui est véhément et caustique, en parlant de paroles ou d'écrits.
6238;interface;tacneifre;˽ ˽ ˽  ˽ ˽ ˽  ˽ ˽ ˽;9;relais;surface;jonction;application;limite;(Chimie) Surface de contact entre deux milieux, deux phases.;Élément permettant de relier diverses fonctions logistiques.;(Informatique) Limite physique ou théorique entre deux systèmes matériels ou logiciels, entre deux parties d’un système ou entre l’utilisateur et sa machine, où s’appliquent les règles et conventions régissant leur interaction. [1]
6240;lamentation;eitlnaamnot;˽ ˽ ˽  ˽ ˽  ˽ ˽  ˽ ˽ ˽ ˽;11;jérémiade;gémissement;plainte;doléance;pleurnicherie;Plainte accompagnée de gémissements et de cris.;Expression de douleur et de regret.;
6242;miaulement;tniumlmeae;˽ ˽ ˽ ˽ ˽  ˽ ˽ ˽ ˽ ˽;10;miaou;feulement;;;;Cri du chat.;Bruit rappelant ce cri.;
6246;prétentieux;éreutnpitex;˽ ˽ ˽  ˽ ˽  ˽ ˽  ˽ ˽ ˽ ˽;11;vaniteux;suffisant;fat;orgueilleux;crâneur;"Qui a des prétentions ; qui est désireux d’attirer l’admiration d’autrui.";Où il y a de la prétention, de l’affectation, de la recherche.;Personne prétentieuse.
6247;psychanalyse;yshaslpcayen;˽ ˽ ˽  ˽ ˽ ˽  ˽ ˽ ˽  ˽ ˽ ˽;12;thérapie;psychothérapie;métapsychologie;introspection;analyse;(Didactique) (Psychanalyse) Méthode d’investigation psychologique qui aide à déceler dans l’esprit l’existence de souvenirs, désirs ou images, dont la présence subconsciente cause des troubles psychiques ou physiques.;Première personne du singulier du présent de l’indicatif de psychanalyser.;Troisième personne du singulier du présent de l’indicatif de psychanalyser.
6252;souffleur;rofslufeu;˽ ˽ ˽  ˽ ˽ ˽  ˽ ˽ ˽;9;dauphin;alchimiste;;;;"Qui souffle comme ayant peine à respirer ; ne se dit guère que des chevaux.";(Verrerie) Ouvrier qui souffle le verre.;Celui, celle qui dit un texte à voix basse pour suppléer au défaut de mémoire de quelqu’un qui parle, qui récite.
6253;adorateur;reaadrotu;˽ ˽ ˽  ˽ ˽ ˽  ˽ ˽ ˽;9;fan;adulateur;fervent;admirateur;sectateur;(Religion) Celui qui adore une divinité.;(Par hyperbole) Celui qui a une estime extraordinaire, et qui admire en tout cette personne.;Qui adore, qui porte une adoration.
6254;affranchi;acafirfnh;˽ ˽ ˽  ˽ ˽ ˽  ˽ ˽ ˽;9;mafioso;affidé;caïd;initié;émancipé;(Par extension) Libre de droit.;Esclave à qui on a rendu la liberté.;Personne dans la confidence.
6255;agissement;tnmsesgiea;˽ ˽ ˽ ˽ ˽  ˽ ˽ ˽ ˽ ˽;10;menées;manigance;comportement;intrigue;manoeuvre;(Justice) Manière de faire, action, acte.;(Au pluriel) Ensemble de manœuvres plus ou moins blâmables pour arriver à un but.;
6256;banderole;bdeorelan;˽ ˽ ˽  ˽ ˽ ˽  ˽ ˽ ˽;9;guidon;bannière;fanion;drapeau;calicot;Petit bande d’étoffe flottante en forme de flamme.;Bande de tissu naturel ou synthétique sur laquelle sont portées des inscriptions notamment politiques, syndicales, publicitaires…;(Emballage) Bande de carton léger (ou autre matière) servant à grouper plusieurs produits.
6257;coalition;coilaoitn;˽ ˽ ˽  ˽ ˽ ˽  ˽ ˽ ˽;9;ligue;fédération;groupement;confédération;parti;(Politique) Réunion de différents partis, ligue de plusieurs puissances.;(Par extension) Ensemble de forces qui s'unissent contre un adversaire commun.;(Économie) Union concertée entre ouvriers, patrons, industriels, commerçants, etc., en vue de modifier ou de maintenir certaines conditions de travail ou d’échange.
6258;congrégation;agognncitréo;˽ ˽ ˽  ˽ ˽ ˽  ˽ ˽ ˽  ˽ ˽ ˽;12;confrérie;corporation;communauté;corps;compagnie;(Religion) Compagnie de religieux, de religieuses ou de prêtres, catholiques, assujettis à des vœux et à une règle commune.;(Religion) Confrérie de dévotion sous l’invocation d’un saint ou d’une sainte.;(Religion) Assemblée de cardinaux et de prélats, de l’Église catholique romaine, soit permanente, soit nommée d’office pour un cas particulier, et chargée d’examiner certaines affaires spéciales.
6259;conquérant;cotnqanuér;˽ ˽ ˽ ˽ ˽  ˽ ˽ ˽ ˽ ˽;10;vainqueur;victorieux;présomptueux;suffisant;conquéreur;Celui qui acquiert par les armes.;(Figuré) Celui qui subjugue par le charme.;Qui conquiert par les armes.
